date,website,url,title,text,translated_title,translated_text,category,main_image
2023-12-09,prothomalo,https://www.prothomalo.com/bangladesh/capital/xnx1brj3dw,জলাশয় ভরাট করে টিস্যু কালচার ল্যাব নির্মাণ বন্ধের দাবি,রাজধানীর মিরপুরে জলাশয় ভরাট করে বাংলাদেশ কৃষি উন্নয়ন করপোরেশন (বিএডিসি) টিস্যু কালচার ল্যাব নির্মাণ।,Demand to stop construction of tissue culture labs by filling water reservoirs,Construction of Bangladesh Agricultural Development Corporation (BADC) tissue culture lab by filling water tank in Mirpur of the capital.,Health,https://images.prothomalo.com/prothomalo-bangla%2F2023-12%2F708efab9-dedb-4bb7-b909-8bca9dc3dcab%2FScreenshot_01122.jpg?rect=0%2C0%2C1495%2C785&w=1200&ar=40%3A21&auto=format%2Ccompress&ogImage=true&mode=crop&overlay=&overlay_position=bottom&overlay_width_pct=1
2023-12-09,prothomalo,https://www.prothomalo.com/world/middle-east/1rvpnx7tj7,গাজায় মানবিক যুদ্ধবিরতির প্রস্তাব আটকে দিল যুক্তরাষ্ট্র,ইসরায়েলের সবচেয়ে ঘনিষ্ঠ মিত্র যুক্তরাষ্ট্র। নিরাপত্তা পরিষদে আবারও ভেটো ক্ষমতা প্রয়োগ।,US blocks proposal for humanitarian ceasefire in Gaza,Israel's closest ally is the United States. The veto power is again exercised in the Security Council.,Business,https://images.prothomalo.com/prothomalo-bangla%2F2023-12%2F49dce543-acb1-4baf-b60c-7279a689a2e1%2F0b1700ad-fa9e-433d-bc4e-d34ef115d2bc.jpg?rect=0%2C40%2C770%2C404&w=1200&ar=40%3A21&auto=format%2Ccompress&ogImage=true&mode=crop&overlay=&overlay_position=bottom&overlay_width_pct=1
2023-12-09,prothomalo,https://www.prothomalo.com/bangladesh/capital/wbur96181k,নেত্রকোনায় উদীচী কার্যালয়ে বোমা হামলায় নিহতদের স্মরণ,২০০৫ সালের এই দিনে নেত্রকোনায় উগ্রবাদী সন্ত্রাসীদের হামলায় প্রাণ হারান উদীচী নেত্রকোনা জেলা সংসদের দুই নেতা।,Remembering those killed in the bomb attack at Udichi office in Netrakona,"On this day in 2005, two leaders of the Udichi Netrokona District Parliament lost their lives in an attack by extremist terrorists in Netrokona.",World,https://images.prothomalo.com/prothomalo-bangla%2F2023-12%2Fb10d133c-1076-46d2-b2c8-869cc9a9be2c%2Fudichi.jpeg?rect=0%2C75%2C2048%2C1075&w=1200&ar=40%3A21&auto=format%2Ccompress&ogImage=true&mode=crop&overlay=&overlay_position=bottom&overlay_width_pct=1
2023-12-09,prothomalo,https://www.prothomalo.com/world/middle-east/j3hu971phv,"মৃত্যুর বিভীষিকা চলছেই, ২৪ ঘণ্টায়
নিহত ৩৫০",গতকাল শুক্রবার গাজাবাসীর এ হাহাকার আরও বেড়েছে। ইসরায়েলি বাহিনী এদিন উপত্যকাটিতে ৪৫০টির বেশি লক্ষ্যবস্তুতে হামলা চালিয়েছে।,"The horror of death continues, in 24 hours
350 killed",The cries of the Gazans increased on Friday. Israeli forces attacked more than 450 targets in the valley that day.,Entertainment,https://images.prothomalo.com/prothomalo-bangla%2F2023-12%2Fcc212d79-0a91-466b-a5f2-2ec3b1e328fa%2F7973deac-7b1f-4c4f-8630-9c245efb72c4.PNG?rect=0%2C74%2C1182%2C621&w=1200&ar=40%3A21&auto=format%2Ccompress&ogImage=true&mode=crop&overlay=&overlay_position=bottom&overlay_width_pct=1
2023-12-09,prothomalo,https://www.prothomalo.com/bangladesh/qenmtjhavp,"তাদের পরবর্তী পরিকল্পনা
দেশে দুর্ভিক্ষ ঘটানো","বিএনপি যাতে জ্বালাও-পোড়াও না করতে পারে, সে জন্য আওয়ামী লীগের নেতা-কর্মীদের সজাগ থাকতে বলেছেন প্রধানমন্ত্রী শেখ হাসিনা।","Their next plan
causing famine in the country",Prime Minister Sheikh Hasina has asked Awami League leaders and workers to be vigilant so that BNP does not incite fire.,Education,https://images.prothomalo.com/prothomalo-bangla%2F2023-10%2F76daa49b-51e3-43f8-a5e3-209927b1d7eb%2FUntitled_1k.jpg?rect=0%2C0%2C1778%2C933&w=1200&ar=40%3A21&auto=format%2Ccompress&ogImage=true&mode=crop&overlay=&overlay_position=bottom&overlay_width_pct=1
2023-12-09,prothomalo,https://www.prothomalo.com/world/e1jgumg19d,১৩ দেশের ৩৭ ব্যক্তির ওপর মার্কিন নিষেধাজ্ঞা ও ভিসা বিধিনিষেধ,মানবাধিকারবিষয়ক জাতিসংঘের সর্বজনীন ঘোষণার ৭৫ বছর পূর্তি সামনে রেখে স্থানীয় সময় শুক্রবার এ ঘোষণা দিয়েছে যুক্তরাষ্ট্র প্রশাসন।,US sanctions and visa restrictions on 37 individuals from 13 countries,The United States administration made this announcement on Friday local time ahead of the 75th anniversary of the United Nations Universal Declaration of Human Rights.,Environment,https://images.prothomalo.com/prothomalo-bangla%2F2023-10%2F334cc5a6-e8aa-40db-b875-84e263eebe6c%2FState_Department.jpg?rect=0%2C23%2C1200%2C630&w=1200&ar=40%3A21&auto=format%2Ccompress&ogImage=true&mode=crop&overlay=https%3A%2F%2Fimages.prothomalo.com%2Fprothomalo-bangla%2F2022-01%2F5a36c819-05a2-4bfb-ac50-57dd67355acb%2FBanner_7814X143.jpg&overlay_position=bottom&overlay_width_pct=1
2023-12-09,prothomalo,https://www.prothomalo.com/sports/cricket/kk62twn5xm,সিরিজ জিততে পারল না বাংলাদেশ,দক্ষিণ আফ্রিকার এই জয়ে তিনি ম্যাচের সিরিজ শেষ হয়েছে ১-১ সমতায়।,Bangladesh could not win the series,South Africa's win ended the series at 1-1.,World,https://images.prothomalo.com/prothomalo-bangla%2F2023-12%2Fa9eb5abc-f7a7-4b08-8080-78cf17f7eeb9%2FShorna_of_BD_player_reacts_after_she_taking_Muneeba_Ali_wicket_During_3rd_Odi_match_1.jpg?rect=0%2C0%2C5472%2C2873&w=1200&ar=40%3A21&auto=format%2Ccompress&ogImage=true&mode=crop&overlay=https%3A%2F%2Fimages.prothomalo.com%2Fprothomalo-bangla%2F2023-10%2Fae7d5c90-d7c9-4623-8d67-1fff8bde16af%2FGPI_2_7814X543.jpg&overlay_position=bottom&overlay_width_pct=1
2023-12-09,prothomalo,https://www.prothomalo.com/sports/cricket/a82bqd2zsj,ভারত বিশ্বকাপ ফাইনালের পিচকে ‘গড়পড়তা’ রেটিং আইসিসির,সব মিলিয়ে বিশ্বকাপের পাঁচ ভেন্যুর আটটি ম্যাচের উইকেট ‘গড়পড়তা’ রেটিং পেয়েছে।,ICC rated India's World Cup final pitch as 'average',"In all, wickets from eight matches across five World Cup venues received an 'average' rating.",Politics,https://images.prothomalo.com/prothomalo-bangla%2F2023-11%2F4520da29-d820-4eb4-9ac3-09788bc6ce89%2F968745_01_02.jpg?rect=0%2C0%2C2497%2C1311&w=1200&ar=40%3A21&auto=format%2Ccompress&ogImage=true&mode=crop&overlay=https%3A%2F%2Fimages.prothomalo.com%2Fprothomalo-bangla%2F2023-10%2Fae7d5c90-d7c9-4623-8d67-1fff8bde16af%2FGPI_2_7814X543.jpg&overlay_position=bottom&overlay_width_pct=1
2023-12-09,haal,https://www.haal.fashion/arrangement/event/jb9dla6fkr,আলোকিতে পপটোক: ঢাকা ফ্লি ফেয়ারে থ্রিফট পণ্যের মেলা,অনলাইন থ্রিফট স্টোর পপ ট্যাগস টুডে আর টোকাইয়ের উদ্যোগে রাজধানীর আলোকি কনভেনশন সেন্টারে অনুষ্ঠিত হলো ‘পপটোক ঢাকা ফ্লি ফেয়ার’।,Poptalk in lights: Thrift goods fair at Dhaka Flea Fair,The 'PopTok Dhaka Flea Fair' was held at Aloki Convention Center in the capital under the initiative of online thrift store Pop Tags Today and Tokai.,Education,https://images.prothomalo.com/prothomalo-bangla%2F2023-12%2F22451f95-1625-4fd7-946d-50187c3d621d%2Fpoptok2.jpg?overlay=https%3A%2F%2Fimages.prothomalo.com%2Fprothomalo-bangla%2F2023-10%2Fdf4c7d13-96dc-4875-b8bf-5aac7b6aa475%2FHaalfashion_gpi_sample3.png&overlay_position=bottom&overlay_opacity=1&w=1200&h=627&auto=format%2Ccompress&ogImage=true&overlay_width_pct=1
2023-12-09,prothomalo,https://www.prothomalo.com/bangladesh/euh893st66,"ঢাকায় শুরু হয়েছে ‘আমার শহর, আমার খাবার’ প্রদর্শনী","ঢাকায় শুরু হয়েছে ‘আমার শহর, আমার খাবার’ প্রদর্শনী। আজ শুক্রবার বাংলা একাডেমির নভেরা গ্যালারিতে এ প্রদর্শনীর উদ্বোধন করা হয়।","""My city, my food"" exhibition has started in Dhaka","""My city, my food"" exhibition has started in Dhaka. This exhibition was inaugurated at Novera Gallery of Bangla Academy on Friday.",Technology,https://images.prothomalo.com/prothomalo-bangla%2F2023-12%2Fbf12d413-7eda-433e-8894-7111093c44e0%2Ffao.JPG?rect=0%2C13%2C748%2C393&w=1200&ar=40%3A21&auto=format%2Ccompress&ogImage=true&mode=crop&overlay=&overlay_position=bottom&overlay_width_pct=1
2023-12-09,prothomalo,https://www.prothomalo.com/photo/bangladesh/ixr3kvqkh6,বগুড়ায় গরুর মেলা,বাংলাদেশ ডেইরি ফারমার্স অ্যাসোসিয়েশনের (বিডিএফএ) উদ্যোগে দুই দিনব্যাপী উত্তরবঙ্গ গরু মেলা আয়োজন করা হয়েছে। আজ শুক্রবার দুপুর সাড়ে ১২টায় এ মেলা উদ্বোধন করা হয়।,Bogra cow fair,A two-day North Bengal Cow Fair has been organized under the initiative of Bangladesh Dairy Farmers Association (BDFA). The fair was inaugurated today at 12:30 noon on Friday.,Entertainment,https://images.prothomalo.com/prothomalo-bangla%2F2023-12%2F5085c749-571c-4d8d-ab70-c1aa4a2c4dda%2F2.jpg?rect=0%2C425%2C3000%2C1575&w=1200&ar=40%3A21&auto=format%2Ccompress&ogImage=true&mode=crop&overlay=https%3A%2F%2Fimages.prothomalo.com%2Fprothomalo-bangla%2F2022-01%2F18c58c05-9e66-46f3-8946-4437460f8f90%2FBanner_7814X143.jpg&overlay_position=bottom&overlay_width_pct=1
2023-12-09,prothomalo,https://www.prothomalo.com/sports/football/swbka3oj1q,পরের মৌসুমে চ্যাম্পিয়নস লিগে খেলা নিয়েই শঙ্কা গার্দিওলার,"প্রিমিয়ার লিগে অজেয় ম্যান সিটি যেন নিজেরাই এখন ভুলে বসে আছে জয়ের মন্ত্র। অবস্থা এমন যে পেপ গার্দিওলা নিজেই নিশ্চিত নন, পরের মৌসুমে চ্যাম্পিয়নস লিগে খেলতে পারবেন কি না।",Guardiola is worried about playing in the Champions League next season,"Man City, invincible in the Premier League, seems to have forgotten the mantra of victory. The situation is such that Pep Guardiola himself is not sure whether he will be able to play in the Champions League next season.",Business,https://images.prothomalo.com/prothomalo-bangla%2F2023-12%2Fe5d66f35-e96f-4841-b271-c2cd511e511a%2Fsteptodown_com684342.jpg?rect=0%2C0%2C2048%2C1075&w=1200&ar=40%3A21&auto=format%2Ccompress&ogImage=true&mode=crop&overlay=https%3A%2F%2Fimages.prothomalo.com%2Fprothomalo-bangla%2F2023-10%2Fae7d5c90-d7c9-4623-8d67-1fff8bde16af%2FGPI_2_7814X543.jpg&overlay_position=bottom&overlay_width_pct=1
2023-12-09,prothomalo,https://www.prothomalo.com/entertainment/drama/hvh5ltcu3s,পারফর্মিং আর্ট ফেস্টিভ্যালে প্রধান বক্তা,পারফর্মিং আর্ট ফেস্টিভ্যালে প্রধান বক্তা,Keynote speaker at the Performing Arts Festival,Keynote speaker at the Performing Arts Festival,Education,https://images.prothomalo.com/prothomalo-bangla%2F2023-12%2F98c36734-d4a2-4301-a436-8ef304c64267%2FWhatsApp_Image_2023_12_06_at_4_11_45_PM__1_.jpeg?rect=0%2C0%2C1280%2C672&w=1200&ar=40%3A21&auto=format%2Ccompress&ogImage=true&mode=crop&overlay=https%3A%2F%2Fimages.prothomalo.com%2Fprothomalo-bangla%2F2023-10%2Fae7d5c90-d7c9-4623-8d67-1fff8bde16af%2FGPI_2_7814X543.jpg&overlay_position=bottom&overlay_width_pct=1
2023-12-09,prothomalo,https://www.prothomalo.com/bangladesh/be6mvcnslr,"প্রতিমন্ত্রী এনামুরের আয় বাড়লেও সম্পদ কমেছে, স্ত্রীর কিছু নেই",দুর্যোগ ব্যবস্থাপনা ও ত্রাণ প্রতিমন্ত্রী মো. এনামুর রহমানের আয় ১০ বছরে বেড়েছে পাঁচ গুণের বেশি।,"State Minister Enamur's income has increased but his wealth has decreased, his wife has nothing",State Minister for Disaster Management and Relief. Enamur Rahman's income increased more than five times in 10 years.,Politics,https://images.prothomalo.com/prothomalo%2Fimport%2Fmedia%2F2018%2F12%2F03%2F8b63d7ffe6209d03df16ae1c73cccfb6-5c04e6ec02f83.jpg?rect=0%2C0%2C1600%2C840&w=1200&ar=40%3A21&auto=format%2Ccompress&ogImage=true&mode=crop&overlay=&overlay_position=bottom&overlay_width_pct=1
2023-12-09,prothomalo,https://www.prothomalo.com/bangladesh/eyowqebca0,"তাপমাত্রা কমছে, শীতের অনুভূতি বাড়ছে",তাপমাত্রা কমার এই প্রবণতা আগামীকাল শনিবারও অব্যাহত থাকবে।,"The temperature is dropping, the feeling of winter is increasing",This trend of decreasing temperature will continue tomorrow and Saturday.,Sports,https://images.prothomalo.com/prothomalo-bangla%2F2023-12%2Ff4cd04fc-7f6f-40bf-b075-6e60c9328441%2F01.jpg?rect=0%2C0%2C4128%2C2167&w=1200&ar=40%3A21&auto=format%2Ccompress&ogImage=true&mode=crop&overlay=&overlay_position=bottom&overlay_width_pct=1
2023-12-09,prothomalo,https://www.prothomalo.com/bangladesh/district/8uhqa382ip,আগুন লেগে কলারোয়ার একটি ক্লিনিকের অস্ত্রোপচার কক্ষ ভস্মীভূত,সাতক্ষীরার কলারোয়ায় আগুন লেগে একটি বেসরকারি ক্লিনিকের অস্ত্রোপচার কক্ষ (ওটি) পুড়ে গেছে। আজ শুক্রবার সন্ধ্যা সাড়ে ৭টার দিকে কলারোয়া সরকারি কলেজের দক্ষিণে সাকিব মেমোরিয়াল ক্লিনিকে এ অগ্নিকাণ্ড ঘটে।,A fire destroyed the surgery room of a clinic in Colorado,"A fire has gutted the operating room (OT) of a private clinic at Kalaroa in Satkhira. The fire broke out at Saqib Memorial Clinic, south of Kalaroa Government College, around 7:30 pm today.",Health,https://images.prothomalo.com/prothomalo-bangla%2F2023-12%2Fadf7c4ac-65a1-44c3-ae58-fb0608b699f4%2FSatkhira_DH0550_2023120.jpg?rect=2%2C0%2C716%2C376&w=1200&ar=40%3A21&auto=format%2Ccompress&ogImage=true&mode=crop&overlay=&overlay_position=bottom&overlay_width_pct=1
2023-12-09,prothomalo,https://www.prothomalo.com/bangladesh/district/r5om3n9ion,গাজায় এত লোক মারা গেলেও বিএনপি মুরব্বিদের খুশি করতে কোনো কথা বলে না: পররাষ্ট্রমন্ত্রী,গাজায় এত লোক মারা গেলেও মুরব্বিদের খুশি করতে বিএনপি কোনো কথা বলে না বলে মন্তব্য করেছেন পররাষ্ট্রমন্ত্রী এ কে আব্দুল মোমেন। আজ শুক্রবার সন্ধ্যায় সিলেট নগরের তোপখানা এলাকার সারদা হলে মৎস্যজীবী লীগের নেতাদের সঙ্গে আলোচনা শেষে সাংবাদিকদের এ কথা বলেন তিনি।,"Despite so many deaths in Gaza, BNP does not say anything to appease the rabbis: Foreign Minister","Foreign Minister AK Abdul Momen commented that even though so many people died in Gaza, BNP did not say anything to please the rabbis. He said this to reporters after a discussion with the leaders of the Fishermen's League at Sarda Hall in Topkhana area of ​​Sylhet city on Friday evening.",Politics,https://images.prothomalo.com/prothomalo-bangla%2F2023-05%2F6d2ab7ba-4410-4f78-bf60-3b017f19fc6f%2FAbdul_Momen.jpg?rect=0%2C0%2C1200%2C630&w=1200&ar=40%3A21&auto=format%2Ccompress&ogImage=true&mode=crop&overlay=&overlay_position=bottom&overlay_width_pct=1
2023-12-09,prothomalo,https://www.prothomalo.com/entertainment/song/d00sum65xn,গুলিতে ঝাঁঝরা হয়েছিল এই শিল্পীদের শরীর,গুলিতে ঝাঁঝরা হয়েছিল এই শিল্পীদের শরীর,The bodies of these artists were riddled with bullets,The bodies of these artists were riddled with bullets,Education,https://images.prothomalo.com/prothomalo-bangla%2F2023-12%2Fc4b77449-9099-4e29-950a-3b9a95a45b22%2FWhatsApp_Image_2023_12_08_at_12_22_27_PM.jpeg?rect=0%2C0%2C1280%2C672&w=1200&ar=40%3A21&auto=format%2Ccompress&ogImage=true&mode=crop&overlay=https%3A%2F%2Fimages.prothomalo.com%2Fprothomalo-bangla%2F2023-10%2Fae7d5c90-d7c9-4623-8d67-1fff8bde16af%2FGPI_2_7814X543.jpg&overlay_position=bottom&overlay_width_pct=1
2023-12-09,prothomalo,https://www.prothomalo.com/sports/cricket/6qtnd0p5do,প্রথম টেস্টের আগে পাকিস্তান দলে দুঃসংবাদ,"আগামীকাল স্ক্যান করার পর জানা যাবে, তাঁর চোট কতটা গুরুতর। তিনি খেলতে না পারলে বদলি খেলোয়াড়ের নাম ঘোষণা করতে পারে পিসিবি।",Bad news for the Pakistan team ahead of the first Test,"The extent of his injury will be known after the scan tomorrow. If he cannot play, PCB can announce the name of the replacement player.",Technology,https://images.prothomalo.com/prothomalo-bangla%2F2023-12%2Ff217961c-39ad-40e3-86fa-d3786232405c%2FGA0JqYraEAAritd.jpg?rect=0%2C0%2C962%2C505&w=1200&ar=40%3A21&auto=format%2Ccompress&ogImage=true&mode=crop&overlay=https%3A%2F%2Fimages.prothomalo.com%2Fprothomalo-bangla%2F2023-10%2Fae7d5c90-d7c9-4623-8d67-1fff8bde16af%2FGPI_2_7814X543.jpg&overlay_position=bottom&overlay_width_pct=1
2023-12-09,prothomalo,https://www.prothomalo.com/poll/nnv3b3amxm,"পুলিশসহ অন্য প্রতিষ্ঠানগুলো এখন দলীয় অনুগত, তাই ওসি–ইউএনওদের বদলি নির্বাচন নিরপেক্ষ করার ক্ষেত্রে তেমন প্রভাব ফেলবে না—টিআইবির নির্বাহী পরিচালক ইফতেখারুজ্জামানের এই বক্তব্যের সঙ্গে আপনি কি একমত?","পুলিশসহ অন্য প্রতিষ্ঠানগুলো এখন দলীয় অনুগত, তাই ওসি–ইউএনওদের বদলি নির্বাচন নিরপেক্ষ করার ক্ষেত্রে তেমন প্রভাব ফেলবে না—টিআইবির নির্বাহী পরিচালক ইফতেখারুজ্জামানের এই বক্তব্যের সঙ্গে আপনি কি একমত?","Other institutions, including the police, are now party loyalists, so the transfer of OC-UNOs will not have much effect in neutralizing the elections—do you agree with the statement of TIB Executive Director Iftekharuzzaman?","Other institutions, including the police, are now party loyalists, so the transfer of OC-UNOs will not have much effect in neutralizing the elections—do you agree with the statement of TIB Executive Director Iftekharuzzaman?",Environment,https://images.prothomalo.com/prothomalo-bangla%2F2023-12%2F1641b3b9-54d7-409d-97cd-dac722b1cf0e%2FUntitled_6.jpg?rect=0%2C0%2C1248%2C655&w=1200&ar=40%3A21&auto=format%2Ccompress&ogImage=true&mode=crop&overlay=&overlay_position=bottom&overlay_width_pct=1
2023-12-09,prothomalo,https://www.prothomalo.com/bangladesh/district/yxrawaumat,পাঁচ বছরে পংকজের অস্থাবর সম্পদ বেড়েছে প্রায় ৩ গুণ,পাঁচ বছরে বরিশাল-৪ (মেহেন্দীগঞ্জ-হিজলা) আসনের সংসদ সদস্য পংকজ নাথের বার্ষিক আয় বেড়েছে মাত্র সাড়ে সাত লাখ টাকা। একই সময়ে তাঁর অস্থাবর সম্পদ বেড়েছে প্রায় তিন গুণ।,Pankaj's movable assets have increased almost 3 times in five years,"In five years, the annual income of Pankaj Nath, Member of Parliament of Barisal-4 (Mehendiganj-Hijla) Constituency has increased by only seven and a half lakh taka. At the same time his movable assets increased almost three times.",Science,https://images.prothomalo.com/prothomalo%2Fimport%2Fmedia%2F2019%2F10%2F16%2Fd021e4dfb46852ab69dc90791a98dd77-5da6a9621fe72.jpg?rect=0%2C35%2C720%2C378&w=1200&ar=40%3A21&auto=format%2Ccompress&ogImage=true&mode=crop&overlay=&overlay_position=bottom&overlay_width_pct=1
2023-12-09,prothomalo,https://www.prothomalo.com/bangladesh/district/mszigv2xq0,দুর্বৃত্তরা আজ দেশে শক্তিমান: রফিউর রাব্বি,ত্বকী হত্যার পর থেকে বিচার শুরু ও চিহ্নিত আসামিদের গ্রেপ্তারের দাবিতে প্রতি মাসের ৮ তারিখ মোমশিখা প্রজ্বালনসহ বিভিন্ন কর্মসূচি পালন করে আসছে নারায়ণগঞ্জ সাংস্কৃতিক জোট।,Rogues are strong in the country today: Rafiur Rabbi,Narayanganj Cultural Alliance has been holding various programs including lighting candles on the 8th of every month to demand the start of trial and the arrest of the identified accused since the murder of Takki.,Education,https://images.prothomalo.com/prothomalo-bangla%2F2023-12%2F9930835e-4a6b-4a06-9c17-6d94705653b4%2FNarayangonj_DH0777_20231208_20231208190355_038A2245.JPG?rect=0%2C0%2C1920%2C1008&w=1200&ar=40%3A21&auto=format%2Ccompress&ogImage=true&mode=crop&overlay=&overlay_position=bottom&overlay_width_pct=1
2023-12-09,bondhushava,https://www.bondhushava.com/writings/9di3jyevgp,আজব আঁধার,"প্রত্যুষ রবি মুখ ঢাকে লজ্জায় নেকাবে
সন্ধ্যা তারার পেছনে সে দাঁড়িয়ে থাকে
ব্যথিত আঁখিতে,
আলোকে আজকাল বেগানা মনে হয়
তার চক্ষুতে পৌঢ়ত্বের ছাপ
আঁধারে পোড়ে আলোর দীপালি
তার ভেতর পোড়ে, বাহির পোড়ে
যেন অগ্নিদগ্ধ চিতা।
বেঁচে আছে অন্ধ, বধির হয়ে
শরীর মোড়ানো আঁধারের বোরকায়।",strange darkness,"Pratyush Ravi will hide his face in shame
He stands behind the evening star
in pained eyes,
Light seems alien these days
A look of maturity in his eyes
Diwali of light burns in darkness
Burning inside, burning outside
Like a burning cheetah.
Living blind, deaf
The body is wrapped in a veil of darkness.",Technology,https://images.prothomalo.com/prothomalo-bangla%2F2023-05%2F37acc8ff-0c83-4d3e-8141-c910c82c97dc%2FCapture___.JPG?rect=15%2C0%2C581%2C305&w=1200&ar=40%3A21&auto=format%2Ccompress&ogImage=true&mode=crop&overlay=https%3A%2F%2Fimages.prothomalo.com%2Fprothomalo-bangla%2F2022-05%2Feb8b952a-4710-4bb3-a408-066b4bbbd9a8%2FFinal_Bondhushava_OG_watermark_01.png&overlay_position=bottom&overlay_width_pct=1
