date,website,url,title,text,translated_title,translated_text,category,main_image
2023-12-09,jugantor,https://www.jugantor.com/todays-paper/city/509010/%E0%A6%A8%E0%A6%BE%E0%A6%B0%E0%A6%BE%E0%A7%9F%E0%A6%A3%E0%A6%97%E0%A6%9E%E0%A7%8D%E0%A6%9C%E0%A7%87-%E0%A6%AD%E0%A7%8B%E0%A6%9F%E0%A6%AF%E0%A7%81%E0%A6%A6%E0%A7%8D%E0%A6%A7%E0%A7%87-%E0%A7%A9%E0%A7%AC-%E0%A6%A8%E0%A6%BE%E0%A6%B0%E0%A7%80-%E0%A6%AA%E0%A7%8D%E0%A6%B0%E0%A6%BE%E0%A6%B0%E0%A7%8D%E0%A6%A5%E0%A7%80,নারায়ণগঞ্জে ভোটযুদ্ধে ৩৬ নারী প্রার্থী,,36 women candidates in election battle in Narayanganj,,Business,https://jugantor.com/fb_share?img=image.jpg
2023-12-09,jugantor,https://www.jugantor.com/todays-paper/ten-horizon/509019/%E0%A6%AB%E0%A7%8D%E0%A6%B0%E0%A6%BE%E0%A6%A8%E0%A7%8D%E0%A6%B8%E0%A7%87-%E0%A6%B6%E0%A6%BF%E0%A6%95%E0%A7%8D%E0%A6%B7%E0%A6%95-%E0%A6%A7%E0%A6%B0%E0%A7%8D%E0%A6%AE%E0%A6%98%E0%A6%9F-%E0%A6%AA%E0%A7%8D%E0%A6%B0%E0%A6%BE%E0%A6%87%E0%A6%AE%E0%A6%BE%E0%A6%B0%E0%A6%BF-%E0%A6%B8%E0%A7%8D%E0%A6%95%E0%A7%81%E0%A6%B2-%E0%A6%AC%E0%A6%A8%E0%A7%8D%E0%A6%A7,"ফ্রান্সে শিক্ষক ধর্মঘট, প্রাইমারি স্কুল বন্ধ",,"Teachers strike in France, primary schools closed",,Health,https://jugantor.com/fb_share?img=image.jpg
2023-12-09,jugantor,https://www.jugantor.com/todays-paper/sub-editorial/509005/%E0%A6%97%E0%A7%8D%E0%A6%B0%E0%A6%BE%E0%A6%AE%E0%A7%80%E0%A6%A3-%E0%A6%9C%E0%A7%80%E0%A6%AC%E0%A6%A8%E0%A7%87-%E0%A6%AF%E0%A6%A8%E0%A7%8D%E0%A6%A4%E0%A7%8D%E0%A6%B0%E0%A7%87%E0%A6%B0-%E0%A6%AA%E0%A7%8D%E0%A6%B0%E0%A6%AD%E0%A6%BE%E0%A6%AC,গ্রামীণ জীবনে যন্ত্রের প্রভাব,,Impact of machinery on rural life,,Education,https://jugantor.com/fb_share?img=image.jpg
2023-12-09,jugantor,https://www.jugantor.com/todays-paper/ten-horizon/509020/%E0%A6%85%E0%A7%8D%E0%A6%AF%E0%A6%BE%E0%A6%A8%E0%A7%8D%E0%A6%9F%E0%A6%BE%E0%A6%B0%E0%A7%8D%E0%A6%95%E0%A6%9F%E0%A6%BF%E0%A6%95%E0%A6%BE%E0%A6%B0-%E0%A6%A4%E0%A6%B2%E0%A6%A6%E0%A7%87%E0%A6%B6%E0%A7%87-%E0%A6%AC%E0%A6%BF%E0%A6%B6%E0%A7%8D%E0%A6%AC%E0%A7%87%E0%A6%B0-%E0%A6%AC%E0%A7%83%E0%A6%B9%E0%A6%A4%E0%A7%8D%E0%A6%A4%E0%A6%AE-%E0%A6%AE%E0%A7%8E%E0%A6%B8%E0%A7%8D%E0%A6%AF-%E0%A6%AA%E0%A7%8D%E0%A6%B0%E0%A6%9C%E0%A6%A8%E0%A6%A8-%E0%A6%95%E0%A7%8D%E0%A6%B7%E0%A7%87%E0%A6%A4%E0%A7%8D%E0%A6%B0,অ্যান্টার্কটিকার তলদেশে বিশ্বের বৃহত্তম মৎস্য প্রজনন ক্ষেত্র,,Under Antarctica is the world's largest fish breeding ground,,Entertainment,https://jugantor.com/fb_share?img=image.jpg
2023-12-09,jugantor,https://www.jugantor.com/doctor-available/508078/%E0%A6%A8%E0%A6%BE%E0%A6%B0%E0%A7%80%E0%A6%B0%E0%A6%BE-%E0%A6%AF%E0%A7%87%E0%A6%B8%E0%A6%AC-%E0%A6%95%E0%A7%8D%E0%A6%AF%E0%A6%BE%E0%A6%A8%E0%A7%8D%E0%A6%B8%E0%A6%BE%E0%A6%B0%E0%A7%87-%E0%A6%AC%E0%A7%87%E0%A6%B6%E0%A6%BF-%E0%A6%86%E0%A6%95%E0%A7%8D%E0%A6%B0%E0%A6%BE%E0%A6%A8%E0%A7%8D%E0%A6%A4-%E0%A6%B9%E0%A6%A8,নারীরা যেসব ক্যান্সারে বেশি আক্রান্ত হন,একজন নারী সাধারণত শারীরিক গঠন এবং বিশেষ হরমোনজনিত কারণে পুরুষের থেকে আলাদা। নারীরা আবার নারী হওয়ার কারণেই কিছু ক্যান্সার তথা গাইনোকোলজিক্যাল ক্যান্সারের ঝুঁকিতে থাকেন।,Women are more affected by cancer,"A woman is generally different from a man due to physical structure and special hormonal reasons. Women are at risk of certain cancers, including gynecological cancers, simply because they are women.",Sports,https://jugantor.com/fb_share?img=image-508078-1641951836.jpg
2023-12-09,jugantor,https://www.jugantor.com/international/508956/%E0%A6%85%E0%A6%A4%E0%A6%BF%E0%A6%A5%E0%A6%BF%E0%A6%A6%E0%A7%87%E0%A6%B0-%E0%A6%9A%E0%A6%B2%E0%A7%87-%E0%A6%AF%E0%A7%87%E0%A6%A4%E0%A7%87-%E0%A6%AC%E0%A6%B2%E0%A7%87%E0%A6%93-%E0%A6%A8%E0%A7%87%E0%A6%9F%E0%A6%BF%E0%A6%9C%E0%A7%87%E0%A6%A8%E0%A6%A6%E0%A7%87%E0%A6%B0-%E0%A6%AE%E0%A6%A8-%E0%A6%95%E0%A6%BE%E0%A7%9C%E0%A6%B2-%E0%A6%B8%E0%A7%8C%E0%A6%A6%E0%A6%BF-%E0%A6%AC%E0%A6%BE%E0%A6%B2%E0%A6%95-%E0%A6%AD%E0%A6%BF%E0%A6%A1%E0%A6%BF%E0%A6%93,অতিথিদের চলে যেতে বলেও নেটিজেনদের মন কাড়ল সৌদি বালক (ভিডিও),বাড়িতে কোনো অতিথিকে দাওয়াত দিলে সাধারণত রকমারি খাবার রান্না করা হয়। আর সেই  নানা পদের খাবার রান্না করতে গেছে অনেকটা সময় কাটাতে হয় রান্নাঘরে। অতিথিদের আপ্যায়নের জন্য মাকে দুইদিন কাটাতে হয়েছে রান্নাঘরে। তাই খাবার পরিবেশনের পর অতিথিদের সোজা বাড়ি চলে যেতে বলে নেটিজেনদের মন কেড়েছে এক সৌদি বালক।,The Saudi boy who asked the guests to leave broke the hearts of the netizens (Video),"When a guest is invited to the house, a variety of food is usually cooked. And to cook those various items, a lot of time has to be spent in the kitchen. Mother had to spend two days in the kitchen to entertain the guests. Therefore, a Saudi boy stole the hearts of netizens by asking the guests to go straight home after serving the food.",Environment,https://jugantor.com/fb_share?img=image-508956-1642176641.jpg
2023-12-09,jugantor,https://www.jugantor.com/video-gallery/bangladesh/166/%E0%A6%AA%E0%A7%82%E0%A6%B0%E0%A7%8D%E0%A6%AC%E0%A6%BE%E0%A6%9A%E0%A6%B2%E0%A7%87-%E0%A6%AA%E0%A7%8D%E0%A6%B0%E0%A6%A5%E0%A6%AE-%E0%A6%A2%E0%A6%BE%E0%A6%95%E0%A6%BE-%E0%A6%86%E0%A6%A8%E0%A7%8D%E0%A6%A4%E0%A6%B0%E0%A7%8D%E0%A6%9C%E0%A6%BE%E0%A6%A4%E0%A6%BF%E0%A6%95-%E0%A6%AC%E0%A6%BE%E0%A6%A3%E0%A6%BF%E0%A6%9C%E0%A7%8D%E0%A6%AF%E0%A6%AE%E0%A7%87%E0%A6%B2%E0%A6%BE,পূর্বাচলে প্রথম ঢাকা আন্তর্জাতিক বাণিজ্যমেলা,পূর্বাচলে প্রথমবারের মতো অনুষ্ঠিত হচ্ছে ঢাকা আন্তর্জাতিক বাণিজ্যমেলা,First Dhaka International Trade Fair in Purbachale,Dhaka International Trade Fair is being held for the first time in Purbachal,Environment,https://www.jugantor.com/assets/video_cover_photos/2022/01/13/cover_photo-166.jpg
2023-12-09,jugantor,https://www.jugantor.com/entertainment/508859/%E0%A6%A1%E0%A6%BF%E0%A6%AD%E0%A7%8B%E0%A6%B0%E0%A7%8D%E0%A6%B8-%E0%A6%A8%E0%A6%BF%E0%A7%9F%E0%A7%87-%E0%A6%AE%E0%A7%81%E0%A6%96-%E0%A6%96%E0%A7%81%E0%A6%B2%E0%A6%B2%E0%A7%87%E0%A6%A8-%E0%A6%AA%E0%A7%8D%E0%A6%B0%E0%A6%BF%E0%A7%9F%E0%A6%BE%E0%A6%99%E0%A7%8D%E0%A6%95%E0%A6%BE,‘ডিভোর্স’ নিয়ে মুখ খুললেন প্রিয়াঙ্কা,বলিউড অভিনেত্রী প্রিয়াঙ্কার নতুন বছর কেমন ছিল তা জানতে কৌতূহলী ছিলেন তার ভক্তরা। এর আগে নভেম্বরে নিকের সঙ্গে আলাদা হওয়ার খবর ছড়িয়ে পড়েছিল সোশ্যাল মিডিয়ায়।,Priyanka opened her mouth about 'divorce',"Bollywood actress Priyanka's fans were curious to know how her new year was. Earlier in November, the news of separation with Nick was spread on social media.",Environment,https://jugantor.com/fb_share?img=image-508859-1642146348.jpg
2023-12-09,jugantor,https://www.jugantor.com/international/508590/%E0%A6%AC%E0%A7%83%E0%A6%B9%E0%A7%8E-%E0%A6%AA%E0%A6%B0%E0%A6%BF%E0%A6%B8%E0%A6%B0%E0%A7%87-%E0%A6%AF%E0%A7%81%E0%A6%A6%E0%A7%8D%E0%A6%A7-%E0%A6%AC%E0%A6%BF%E0%A6%AE%E0%A6%BE%E0%A6%A8-%E0%A6%89%E0%A7%8E%E0%A6%AA%E0%A6%BE%E0%A6%A6%E0%A6%A8%E0%A7%87-%E0%A6%AF%E0%A6%BE%E0%A6%9A%E0%A7%8D%E0%A6%9B%E0%A7%87-%E0%A6%A4%E0%A7%81%E0%A6%B0%E0%A6%B8%E0%A7%8D%E0%A6%95%C2%A0,বৃহৎ পরিসরে যুদ্ধ বিমান উৎপাদনে যাচ্ছে তুরস্ক,"তুরস্কের প্রতিরক্ষা শিল্প এক্সিকিউটিভ কমিটি বুধবার সিদ্ধান্ত নিয়েছে, নিজেদের তৈরি হালকা যুদ্ধবিমান হুরজেট বৃহৎ পরিসরে উৎপাদন করবে তারা।",Türkiye is going to produce warplanes on a large scale,Turkey's Defense Industry Executive Committee decided on Wednesday to mass-produce its own Hurjet light fighter.,Environment,https://jugantor.com/fb_share?img=image-508590-1642092075.jpg
2023-12-09,jugantor,https://www.jugantor.com/international/507797/%E0%A6%AA%E0%A7%87%E0%A6%81%E0%A6%AA%E0%A7%87-%E0%A6%AC%E0%A6%BF%E0%A6%95%E0%A7%8D%E0%A6%B0%E0%A7%87%E0%A6%A4%E0%A6%BE%E0%A6%B0-%E0%A6%B8%E0%A6%99%E0%A7%8D%E0%A6%97%E0%A7%87-%E0%A6%A8%E0%A6%BE%E0%A6%B0%E0%A7%80%E0%A6%B0-%E0%A6%8F-%E0%A6%95%E0%A7%87%E0%A6%AE%E0%A6%A8-%E0%A6%86%E0%A6%9A%E0%A6%B0%E0%A6%A3-%E0%A6%AD%E0%A6%BF%E0%A6%A1%E0%A6%BF%E0%A6%93,পেঁপে বিক্রেতার সঙ্গে নারীর এ কেমন আচরণ! (ভিডিও),সালোয়ার কামিজ পরা একজন নারী ঠেলাগাড়ি থেকে পেঁপে নিয়ে সাজোরে রাস্তায় ছুড়ে ফেলছেন।,What kind of behavior of women with papaya sellers! (video),A woman in a salwar kameez takes papayas from a wheelbarrow and throws them on the road in Sajor.,Health,https://jugantor.com/fb_share?img=image-507797-1641907725.jpg
2023-12-09,jugantor,https://www.jugantor.com/todays-paper/sports/509047/%E0%A6%AC%E0%A6%BF%E0%A6%9C%E0%A7%9F-%E0%A6%A6%E0%A6%BF%E0%A6%AC%E0%A6%B8-%E0%A6%AD%E0%A6%B2%E0%A6%BF%E0%A6%AC%E0%A6%B2,বিজয় দিবস ভলিবল,,Victory Day Volleyball,,Education,https://jugantor.com/fb_share?img=image.jpg
2023-12-09,jugantor,https://www.jugantor.com/politics/awami-league/508888/%E0%A6%AC%E0%A6%BF%E0%A6%A8%E0%A6%BE-%E0%A6%AC%E0%A6%BF%E0%A6%9A%E0%A6%BE%E0%A6%B0%E0%A7%87-%E0%A6%AC%E0%A6%B9%E0%A7%81-%E0%A6%B8%E0%A6%BE%E0%A6%AE%E0%A6%B0%E0%A6%BF%E0%A6%95-%E0%A6%85%E0%A6%AB%E0%A6%BF%E0%A6%B8%E0%A6%BE%E0%A6%B0-%E0%A6%9C%E0%A7%8B%E0%A7%9F%E0%A6%BE%E0%A6%A8%E0%A6%95%E0%A7%87-%E0%A6%AB%E0%A6%BE%E0%A6%81%E0%A6%B8%E0%A6%BF-%E0%A6%A6%E0%A7%87%E0%A6%93%E0%A7%9F%E0%A6%BE-%E0%A6%B9%E0%A7%9F%E0%A7%87%E0%A6%9B%E0%A7%87,‘বিনা বিচারে বহু সামরিক অফিসার জোয়ানকে ফাঁসি দেওয়া হয়েছে’,‘দেশে সবচেয়ে বড় মানবাধিকার লঙ্ঘনের ঘটনা হচ্ছে বঙ্গবন্ধু শেখ মুজিবুর রহমানের হত্যা ও হত্যার বিচারের পথ রুদ্ধ করা। এটি হচ্ছে বাংলাদেশে সবচেয়ে বড় মানবাধিকার লঙ্ঘনের ঘটনা।’,"""Many military officers were hanged without trial"".",The biggest human rights violation in the country is the killing of Bangabandhu Sheikh Mujibur Rahman and blocking the way to the trial of the murder. This is the biggest human rights violation in Bangladesh.,Education,https://jugantor.com/fb_share?img=image-508888-1642157690.jpg
2023-12-09,jugantor,https://www.jugantor.com/international/508947/%E0%A6%AB%E0%A6%BF%E0%A6%B2%E0%A7%8D%E0%A6%AE%E0%A6%BF-%E0%A6%B8%E0%A7%8D%E0%A6%9F%E0%A6%BE%E0%A6%87%E0%A6%B2%E0%A7%87-%E0%A6%9A%E0%A7%8B%E0%A6%B0-%E0%A6%A7%E0%A6%B0%E0%A6%B2%E0%A7%87%E0%A6%A8-%E0%A6%AA%E0%A7%81%E0%A6%B2%E0%A6%BF%E0%A6%B6-%E0%A6%AD%E0%A6%BF%E0%A6%A1%E0%A6%BF%E0%A6%93,ফিল্মি স্টাইলে চোর ধরলেন পুলিশ (ভিডিও),"প্রাণপনে দৌড়াচ্ছিলেন দুই ব্যক্তি। দেখে মনে হচ্ছিল প্রথম ব্যক্তিকে ধাওয়া করছে দ্বিতীয়জন। বিষয়টি চোখে পড়ায় পুলিশও তাদের পিছু নেয়। ব্যস্ত রাস্তায়, অলিগলির মধ্যে একদম ফিল্মি স্টাইলে ওই দুই ব্যক্তির পিছু নেয় পুলিশ। ধরে ফেলে একজনকে। এরপর জানা যায় আসল ঘটনা।",Police caught thief in filmy style (Video),"Two people were running. It looked like the first person was being chased by the second person. The police also chased them as the matter became visible. The police chased the two men in a filmy style through the busy streets, alleyways. Catch someone. Then the real story is revealed.",Sports,https://jugantor.com/fb_share?img=image-508947-1642175365.jpg
2023-12-09,jugantor,https://www.jugantor.com/todays-paper/window/509008/%E0%A6%A6%E0%A7%8D%E0%A6%B0%E0%A6%AC%E0%A7%8D%E0%A6%AF%E0%A6%AE%E0%A7%82%E0%A6%B2%E0%A7%8D%E0%A6%AF-%E0%A6%AC%E0%A6%BE%E0%A7%9C%E0%A7%87-%E0%A6%95%E0%A7%87%E0%A6%A8,দ্রব্যমূল্য বাড়ে কেন,,Why do prices increase?,,Entertainment,https://jugantor.com/fb_share?img=image.jpg
2023-12-09,jugantor,https://www.jugantor.com/todays-paper/it-world/508341/%E0%A6%87%E0%A6%89%E0%A6%9F%E0%A6%BF%E0%A6%89%E0%A6%AC%E0%A7%87%E0%A6%B0-%E0%A6%AA%E0%A6%BF%E0%A6%95%E0%A6%9A%E0%A6%BE%E0%A6%B0%E0%A6%87%E0%A6%A8%E0%A6%AA%E0%A6%BF%E0%A6%95%E0%A6%9A%E0%A6%BE%E0%A6%B0-%E0%A6%AC%E0%A7%8D%E0%A6%AF%E0%A6%AC%E0%A6%B9%E0%A6%BE%E0%A6%B0%E0%A7%87%E0%A6%B0-%E0%A6%89%E0%A6%AA%E0%A6%BE%E0%A7%9F,ইউটিউবের ‘পিকচার-ইন-পিকচার’ ব্যবহারের উপায়,ইউটিউবের ‘পিকচার-ইন-পিকচার’ ব্যবহারের উপায়,How to use YouTube's 'picture-in-picture',How to use YouTube's 'picture-in-picture',Health,https://jugantor.com/fb_share?img=image-508341-1642053842.jpg
2023-12-09,jugantor,https://www.jugantor.com/todays-paper/it-world/509057/%E0%A6%AE%E0%A6%BE%E0%A6%87%E0%A6%95%E0%A7%8D%E0%A6%B0%E0%A7%8B%E0%A6%B8%E0%A6%AB%E0%A6%9F%E0%A7%87%E0%A6%B0-%E0%A6%8F%E0%A6%95%E0%A7%8D%E0%A6%B8%E0%A6%AC%E0%A6%95%E0%A7%8D%E0%A6%B8-%E0%A6%93%E0%A7%9F%E0%A6%BE%E0%A6%A8-%E0%A6%95%E0%A6%A8%E0%A6%B8%E0%A7%8B%E0%A6%B2%E0%A7%87%E0%A6%B0-%E0%A6%89%E0%A7%8E%E0%A6%AA%E0%A6%BE%E0%A6%A6%E0%A6%A8-%E0%A6%AC%E0%A6%A8%E0%A7%8D%E0%A6%A7,মাইক্রোসফটের এক্সবক্স ওয়ান কনসোলের উৎপাদন বন্ধ,,Production of Microsoft's Xbox One console has stopped,,Health,https://jugantor.com/fb_share?img=image.jpg
2023-12-09,jugantor,https://www.jugantor.com/country-news/508979/%E0%A6%B6%E0%A7%87%E0%A6%B7-%E0%A6%B8%E0%A6%AE%E0%A7%9F%E0%A7%87-%E0%A6%B8%E0%A6%82%E0%A6%AC%E0%A6%BE%E0%A6%A6-%E0%A6%B8%E0%A6%AE%E0%A7%8D%E0%A6%AE%E0%A7%87%E0%A6%B2%E0%A6%A8%E0%A7%87-%E0%A6%AF%E0%A7%87-%E0%A6%B6%E0%A6%99%E0%A7%8D%E0%A6%95%E0%A6%BE%E0%A6%B0-%E0%A6%95%E0%A6%A5%E0%A6%BE-%E0%A6%9C%E0%A6%BE%E0%A6%A8%E0%A6%BE%E0%A6%B2%E0%A7%87%E0%A6%A8-%E0%A6%A4%E0%A7%88%E0%A6%AE%E0%A7%81%E0%A6%B0-%E0%A6%AD%E0%A6%BF%E0%A6%A1%E0%A6%BF%E0%A6%93,শেষ সময়ে সংবাদ সম্মেলনে যে শঙ্কার কথা জানালেন তৈমুর (ভিডিও),"নির্বাচন কমিশনের বিভিন্ন কর্মকাণ্ডকে ‘হঠকারী’ বলে মন্তব্য করে সেসব প্রধানমন্ত্রীর কাছে তুলে ধরতে গণমাধ্যমের প্রতি আহবান জানিয়েছেন স্বতন্ত্র মেয়র প্রার্থী অ্যাডভোকেট তৈমুর আলম খন্দকার। তিনি বলেছেন, নির্বাচন কমিশনের নির্লিপ্ততা ও প্রশাসনের কারণে আমরা সুষ্ঠু ভোটগ্রহণ নিয়ে শঙ্কিত।",Timur's concern at the last press conference (Video),"Independent mayoral candidate Advocate Taimur Alam Khandkar called on the media to highlight the various activities of the Election Commission as 'obstinate' to the Prime Minister. He said, due to the impartiality and administration of the Election Commission, we are worried about fair polling.",Sports,https://jugantor.com/fb_share?img=image-508979-1642183050.jpg
2023-12-09,jugantor,https://www.jugantor.com/international/507702/%E0%A6%AF%E0%A6%BE%E0%A6%A4%E0%A7%8D%E0%A6%B0%E0%A7%80%E0%A6%AC%E0%A6%BE%E0%A6%B9%E0%A7%80-%E0%A6%AC%E0%A6%BE%E0%A6%B8-%E0%A6%A0%E0%A7%87%E0%A6%B2%E0%A7%87-%E0%A6%A8%E0%A6%BF%E0%A7%9F%E0%A7%87-%E0%A6%97%E0%A7%87%E0%A6%B2-%E0%A6%AC%E0%A6%A8%E0%A7%8D%E0%A6%AF-%E0%A6%B9%E0%A6%BE%E0%A6%A4%E0%A6%BF-%E0%A6%AD%E0%A6%BF%E0%A6%A1%E0%A6%BF%E0%A6%93,যাত্রীবাহী বাস ঠেলে নিয়ে গেল বন্য হাতি (ভিডিও),হঠাৎ করেই বন্যহাতিটি যাত্রীবাহী বাসটির পেছনে আসতে শুরু করে,Wild Elephant Pushes Passenger Bus (VIDEO),Suddenly the wild elephant started coming behind the passenger bus,World,https://jugantor.com/fb_share?img=image-507702-1641865488.jpg
2023-12-09,jugantor,https://www.jugantor.com/country-news/508973/%E0%A6%AC%E0%A6%BF%E0%A6%9C%E0%A7%9F-%E0%A6%86%E0%A6%AE%E0%A6%BE%E0%A6%A6%E0%A7%87%E0%A6%B0-%E0%A6%B8%E0%A7%81%E0%A6%A8%E0%A6%BF%E0%A6%B6%E0%A7%8D%E0%A6%9A%E0%A6%BF%E0%A6%A4-%E0%A6%86%E0%A6%87%E0%A6%AD%E0%A7%80,বিজয় আমাদের সুনিশ্চিত: আইভী,"নারায়ণগঞ্জ সিটি করপোরেশন নির্বাচনে প্রচারণার শেষ দিনে শুক্রবার আওয়ামী লীগের প্রার্থী ডা. সেলিনা হায়াত আইভী বলেন, সন্ত্রাসমুক্ত নারায়ণগঞ্জ করার জন্য, দুর্নীতিমুক্ত নারায়ণগঞ্জ গড়ার জন্য নিশ্চয়ই আপনারা আমাকে ভোট দিবেন।",Victory is assured: Ivy,"Awami League candidate Dr. Narayanganj City Corporation election on the last day of the campaign on Friday. Selina Hayat Ivy said, you will definitely vote for me to make Narayanganj free from terrorism, to make Narayanganj free from corruption.",Politics,https://jugantor.com/fb_share?img=image-508973-1642178791.jpg
2023-12-09,jugantor,https://www.jugantor.com/todays-paper/it-world/508342/%E0%A6%86%E0%A6%87%E0%A6%AE%E0%A7%87%E0%A6%B8%E0%A7%87%E0%A6%9C-%E0%A6%A8%E0%A6%BF%E0%A7%9F%E0%A7%87-%E0%A6%85%E0%A7%8D%E0%A6%AF%E0%A6%BE%E0%A6%AA%E0%A6%B2%E0%A6%95%E0%A7%87%E0%A6%87-%E0%A6%A6%E0%A7%81%E0%A6%B7%E0%A6%B2%E0%A7%87%E0%A6%A8-%E0%A6%97%E0%A7%81%E0%A6%97%E0%A6%B2-%E0%A6%A8%E0%A6%BF%E0%A6%B0%E0%A7%8D%E0%A6%AC%E0%A6%BE%E0%A6%B9%E0%A7%80,আইমেসেজ নিয়ে অ্যাপলকেই দুষলেন গুগল নির্বাহী,আইমেসেজ নিয়ে অ্যাপলকেই দুষলেন গুগল নির্বাহী,Google executive blames Apple with iMessage,Google executive blames Apple with iMessage,World,https://jugantor.com/fb_share?img=image-508342-1642053886.jpg
2023-12-09,jugantor,https://www.jugantor.com/todays-paper/features/islam-and-life/506034/%E0%A6%B8%E0%A7%8D%E0%A6%AC%E0%A6%BE%E0%A6%AE%E0%A7%80%E0%A6%B0-%E0%A6%89%E0%A6%A4%E0%A7%8D%E0%A6%A4%E0%A6%B0%E0%A6%BE%E0%A6%A7%E0%A6%BF%E0%A6%95%E0%A6%BE%E0%A6%B0-%E0%A6%93-%E0%A6%9C%E0%A6%BE%E0%A6%A8%E0%A7%87%E0%A6%B0-%E0%A6%B8%E0%A6%A6%E0%A6%95%E0%A6%BE-%E0%A6%AA%E0%A7%8D%E0%A6%B0%E0%A6%B8%E0%A6%99%E0%A7%8D%E0%A6%97%E0%A7%87,স্বামীর উত্তরাধিকার ও জানের সদকা প্রসঙ্গে,প্রশ্ন : ছেলেমেয়ে থাকাবস্থায় স্বামী মারা গেলে স্ত্রী স্বামীর সম্পদ কতটুকু পাবে?,Regarding husband's inheritance and Jan's charity,"Question: If the husband dies while the child is still alive, how much will the wife get from the husband's property?",Science,https://jugantor.com/fb_share?img=image-506034-1641656843.jpg
2023-12-09,jugantor,https://www.jugantor.com/country-news/508951/%E0%A6%A8%E0%A6%BF%E0%A6%9C%E0%A7%87%E0%A6%B0-%E0%A6%B8%E0%A6%82%E0%A6%B8%E0%A6%BE%E0%A6%B0%E0%A7%87%E0%A6%B0-%E0%A6%A6%E0%A6%BF%E0%A6%95%E0%A7%87-%E0%A6%A4%E0%A6%BE%E0%A6%95%E0%A6%BE%E0%A6%87-%E0%A6%A8%E0%A6%BE%E0%A6%87-%E0%A6%86%E0%A6%AA%E0%A6%A8%E0%A6%BE%E0%A6%A6%E0%A7%87%E0%A6%B0-%E0%A6%B8%E0%A7%87%E0%A6%AC%E0%A6%BE-%E0%A6%95%E0%A6%B0%E0%A7%87-%E0%A6%97%E0%A7%87%E0%A6%9B%E0%A6%BF-%E0%A6%86%E0%A6%87%E0%A6%AD%E0%A7%80,"নিজের সংসারের দিকে তাকাই নাই, আপনাদের সেবা করে গেছি: আইভী",সন্ত্রাস ও দুর্নীতিমুক্ত নারায়ণগঞ্জ গড়ার প্রতিশ্রুতি দিয়ে নৌকায় ভোট চেয়েছেন আওয়ামী লীগের মেয়র প্রার্থী ডা. সেলিনা হায়াত আইভী।,"I have not looked at my family, I have served you: Ivy",Awami League mayoral candidate Dr. Selina Hyatt Ivy.,Education,https://jugantor.com/fb_share?img=image-508951-1642175613.jpg
2023-12-09,jugantor,https://www.jugantor.com/economics/bank/508512/%E0%A6%A8%E0%A6%BE%E0%A6%B0%E0%A6%BE%E0%A7%9F%E0%A6%A3%E0%A6%97%E0%A6%9E%E0%A7%8D%E0%A6%9C%E0%A6%B8%E0%A6%B9-%E0%A6%AC%E0%A7%87%E0%A6%B6-%E0%A6%95%E0%A7%9F%E0%A7%87%E0%A6%95%E0%A6%9F%E0%A6%BF-%E0%A6%8F%E0%A6%B2%E0%A6%BE%E0%A6%95%E0%A6%BE%E0%A7%9F-%E0%A6%AC%E0%A7%8D%E0%A6%AF%E0%A6%BE%E0%A6%82%E0%A6%95-%E0%A6%AC%E0%A6%A8%E0%A7%8D%E0%A6%A7-%E0%A6%B0%E0%A7%8B%E0%A6%AC%E0%A6%AC%E0%A6%BE%E0%A6%B0,নারায়ণগঞ্জসহ বেশ কয়েকটি এলাকায় ব্যাংক বন্ধ রোববার,"আগামী রোববার দেশের বেশ কয়েকটি জায়গায় নির্বাচন অনুষ্ঠিত হবে। টাঙ্গাইল-৭ আসনের উপনির্বাচন, নারায়ণগঞ্জ সিটি করপোরেশন ও বিভিন্ন জেলার ৫টি পৌরসভায় ওইদিন ভোটগ্রহণ হবে। এ জন্য ওই দিন ভোট সংশ্লিষ্ট এলাকায় অবস্থিত সব তফসিলি ব্যাংকের শাখা-উপশাখা বন্ধ রাখার নির্দেশনা দেওয়া হয়েছে।",Banks are closed in several areas including Narayanganj on Sunday,"Elections will be held in several places of the country next Sunday. Tangail-7 seat by-election, Narayanganj City Corporation and 5 municipalities of different districts will be polled on that day. For this, instructions have been given to close all scheduled bank branches located in polling-related areas on that day.",Education,https://jugantor.com/fb_share?img=image-508512-1642073377.jpg
2023-12-09,jugantor,https://www.jugantor.com/national/508928/%E0%A6%AC%E0%A6%99%E0%A7%8D%E0%A6%97%E0%A6%AC%E0%A6%A8%E0%A7%8D%E0%A6%A7%E0%A7%81%E0%A6%B0-%E0%A6%B8%E0%A7%8D%E0%A6%AC%E0%A6%AA%E0%A7%8D%E0%A6%A8-%E0%A6%9B%E0%A6%BF%E0%A6%B2-%E0%A6%A6%E0%A7%8D%E0%A6%AC%E0%A7%80%E0%A6%AA%E0%A6%AC%E0%A6%BE%E0%A6%B8%E0%A7%80%E0%A6%B0-%E0%A6%89%E0%A6%A8%E0%A7%8D%E0%A6%A8%E0%A6%AF%E0%A6%BC%E0%A6%A8-%E0%A6%AA%E0%A6%B0%E0%A7%8D%E0%A6%AF%E0%A6%9F%E0%A6%A8-%E0%A6%AA%E0%A7%8D%E0%A6%B0%E0%A6%A4%E0%A6%BF%E0%A6%AE%E0%A6%A8%E0%A7%8D%E0%A6%A4%E0%A7%8D%E0%A6%B0%E0%A7%80,বঙ্গবন্ধুর স্বপ্ন ছিল দ্বীপবাসীর উন্নয়ন: পর্যটন প্রতিমন্ত্রী,"বেসামরিক বিমান পরিবহণ ও পর্যটন প্রতিমন্ত্রী এম মাহবুব আলী বলেছেন, ঢাকায় যদি গাড়ি চলে তাহলে এই হাতিয়া দ্বীপে গাড়ি চলবে।",Bangabandhu's dream was the development of islanders: Minister of State for Tourism,State Minister for Civil Aviation and Tourism M Mahbub Ali said that if cars run in Dhaka then the cars will run in Hatia Island.,Entertainment,https://jugantor.com/fb_share?img=image-508928-1642171586.jpg
