date,website,url,title,text,translated_title,translated_text,category,main_image
2023-12-09,kishoralo,https://www.kishoralo.com/feature/8sd4cd1dmi,আট বিলিয়ন মানুষের পৃথিবীতে তুষারপাত দেখেছে কতজন,"অনেক দেশেই বছর ঘুরতে তুষারপাত দেখতে পাওয়া যায়। কিন্তু যদি প্রশ্ন করি, বাংলাদেশে আমরা কেন বরফ পড়তে দেখি না, তুমি অবশ্যই অবাক হবে না।",How many people have seen snowfall in the world of eight billion people?,"Many countries experience snowfall throughout the year. But if you ask why we don't see snow in Bangladesh, you will not be surprised.",Science,https://images.prothomalo.com/prothomalo-bangla%2F2023-04%2F7d36c267-537e-4599-a0e6-d22e3682ed2b%2F5.jpg?rect=0%2C409%2C5297%2C2781&w=1200&ar=40%3A21&auto=format%2Ccompress&ogImage=true&mode=crop&overlay=https%3A%2F%2Fimages.prothomalo.com%2Fprothomalo-bangla%2F2021-06%2Fbe2d99ee-c039-4acf-a6fb-2356c69a08a6%2FKIA_OG_watermark_final.png&overlay_position=bottom&overlay_width_pct=1
2023-12-09,bondhushava,https://www.bondhushava.com/writings/m9sjlldpu0,শেষ চিঠি,"জারুলগাছের নিচে বসে তুমি আমার কাঁধে যেদিন প্রথমবার মাথা রাখলে, সেই দিনটার কথা মনে আছে কি তোমার? সম্ভবত ভুলে গেছ তুমি। তবে আমার বেশ মনে আছে; সেদিনকার স্মৃতি এখনো আমায় উদ্বেল করে, সেই মায়াময়রূপ, স্নিগ্ধ চাহনি, মিষ্টি হাসি। আমার কবিতার মূর্তি! আমি কী করে ভুলব বলতে পারো?",last letter,"Do you remember the day when you put your head on my shoulder while sitting under the jarul tree? Maybe you forgot. But I remember well; The memory of that day still haunts me, that magical look, sweet look, sweet smile. My idol of poetry! How can I forget?",Politics,https://images.prothomalo.com/prothomalo-bangla%2F2023-12%2F4e5c6978-795b-480c-9247-ce904c2febb5%2F19898f16-d5df-4b5b-8212-55a7501c0e83.jpg?rect=0%2C30%2C1600%2C840&w=1200&ar=40%3A21&auto=format%2Ccompress&ogImage=true&mode=crop&overlay=https%3A%2F%2Fimages.prothomalo.com%2Fprothomalo-bangla%2F2022-05%2Feb8b952a-4710-4bb3-a408-066b4bbbd9a8%2FFinal_Bondhushava_OG_watermark_01.png&overlay_position=bottom&overlay_width_pct=1
2023-12-09,prothomalo,https://www.prothomalo.com/bangladesh/district/2xhl6lts8z,"জাবির সাবেক শিক্ষার্থী নিহতের প্রতিবাদে মানববন্ধন, বাসের রুট পারমিট বাতিলের দাবি",ঢাকা-আরিচা মহাসড়কের ধামরাই বাসস্ট্যান্ডে বাসের জন্য অপেক্ষায় ছিলেন রুবেল পারভেজ। সেখানে সেলফি পরিবহনের দুটি বাসের রেষারেষির সময় একটি বাসের চাপায় নিহত হন তিনি।,"Human chain protesting the death of Jabi's former student, demand cancellation of bus route permit",Rubel Parvez was waiting for the bus at Dhamrai bus stand on Dhaka-Aricha highway. He was killed by a bus during a race between two buses of Selfie transport there.,Politics,https://images.prothomalo.com/prothomalo-bangla%2F2023-12%2F45fb5339-90b0-4a5a-8b3f-c1c3de796e70%2FJU_DH1642_20231208_IMG_20231208_114121_AECOQIYN7J_JPG.JPG?rect=0%2C465%2C4080%2C2142&w=1200&ar=40%3A21&auto=format%2Ccompress&ogImage=true&mode=crop&overlay=&overlay_position=bottom&overlay_width_pct=1
2023-12-09,prothomalo,https://www.prothomalo.com/sports/cricket/95cb61i2kk,ফিলিপসের পাল্টা আক্রমণে লিড নিউজিল্যান্ডের,"পাল্টা আক্রমণ করে ৮৭ রানের ইনিংস খেলে নিউজিল্যান্ডের স্কোরকে ১৮০ রানে নিয়ে যান ফিলিপস, ফলে প্রথম ইনিংসে ৮ রানে এগিয়ে গেছে সফরকারীরা।",New Zealand's lead in Phillips' counterattack,"Phillips counter-attacked with an innings of 87 runs to take New Zealand's score to 180, giving the visitors an 8-run lead in the first innings.",Environment,https://images.prothomalo.com/prothomalo-bangla%2F2023-12%2F5cfbc874-3eb9-4238-ba52-8a2da97d1811%2F201f77df_cbd5_45b4_ad8a_59ee321f079c.jpg?rect=0%2C0%2C1280%2C672&w=1200&ar=40%3A21&auto=format%2Ccompress&ogImage=true&mode=crop&overlay=https%3A%2F%2Fimages.prothomalo.com%2Fprothomalo-bangla%2F2023-10%2Fae7d5c90-d7c9-4623-8d67-1fff8bde16af%2FGPI_2_7814X543.jpg&overlay_position=bottom&overlay_width_pct=1
2023-12-09,prothomalo,https://www.prothomalo.com/chakri/employment/ggj56aaat2,"বিশ্ববিদ্যালয় মঞ্জুরি কমিশনে চাকরি, আবেদন ই-মেইলে",বাংলাদেশ বিশ্ববিদ্যালয় মঞ্জুরি কমিশন ‘হায়ার এডুকেশন অ্যাকসিলারেশন অ্যান্ড ট্রান্সফরমেশন (হিট)’ প্রকল্পে প্রকল্প পরিচালক নিয়োগ দেবে। আগ্রহী প্রার্থীদের নির্ধারিত ফরম পূরণ করে ই-মেইলে পাঠাতে হবে।,"Jobs in University Grants Commission, Apply by e-mail",Bangladesh University Grants Commission will appoint a Project Director for the 'Higher Education Acceleration and Transformation (HIT)' project. Interested candidates should fill the prescribed form and send it by e-mail.,Education,https://images.prothomalo.com/prothomalo-bangla%2F2023-12%2Fb9b90477-215e-49fc-9b81-ffb4bdaa5ed5%2Fprothomalo_bangla_2023_06_5dbbb70a_697f_41bc_85bc_e74424dc6c33_Untitled_2.jpg?rect=0%2C0%2C640%2C336&w=1200&ar=40%3A21&auto=format%2Ccompress&ogImage=true&mode=crop&overlay=https%3A%2F%2Fimages.prothomalo.com%2Fprothomalo-bangla%2F2022-01%2F18c58c05-9e66-46f3-8946-4437460f8f90%2FBanner_7814X143.jpg&overlay_position=bottom&overlay_width_pct=1
2023-12-09,prothomalo,https://www.prothomalo.com/world/68eylfjzn6,ইতিহাসের এই দিনে: প্রথম করোনার টিকা নিলেন ৯০ বছরের মার্গারেট,"আজ ৮ ডিসেম্বর। চলুন দেখি, বিশ্বে এই দিন কী কী বড় ঘটনা ঘটেছিল।",On this day in history: 90-year-old Margaret received the first corona vaccine,Today is December 8. Let's see what big events happened in the world on this day.,Sports,https://images.prothomalo.com/prothomalo-bangla%2F2023-12%2F9a079344-1514-44ac-a99a-79ccb9523cf1%2Fprothomalo_vaccine.webp?rect=0%2C31%2C640%2C336&w=1200&ar=40%3A21&auto=format%2Ccompress&ogImage=true&mode=crop&overlay=https%3A%2F%2Fimages.prothomalo.com%2Fprothomalo-bangla%2F2022-01%2F5a36c819-05a2-4bfb-ac50-57dd67355acb%2FBanner_7814X143.jpg&overlay_position=bottom&overlay_width_pct=1
2023-12-09,prothomalo,https://www.prothomalo.com/sports/cricket/q1wl6jb96i,জনসনের সমালোচনার জবাবে মুখ খুললেন ওয়ার্নার,"জনসনের সমালোচনা যতটা কড়া হয়েছিল, ওয়ার্নার জবাব দিতে গিয়ে সেটির ধারেকাছেও যাননি। একরকম হেসেই উড়িয়ে দিয়েছেন তা।",Warner responded to Johnson's criticism,"As harsh as Johnson's criticism was, Warner didn't even come close to responding. Somehow he dismissed it with a smile.",Environment,https://images.prothomalo.com/prothomalo-bangla%2F2023-12%2F360486ea-e6ba-4d30-822b-ed5c2d069fde%2FDavid_Warner_Reuters_4.JPG?rect=0%2C24%2C5546%2C2912&w=1200&ar=40%3A21&auto=format%2Ccompress&ogImage=true&mode=crop&overlay=https%3A%2F%2Fimages.prothomalo.com%2Fprothomalo-bangla%2F2023-10%2Fae7d5c90-d7c9-4623-8d67-1fff8bde16af%2FGPI_2_7814X543.jpg&overlay_position=bottom&overlay_width_pct=1
2023-12-09,prothomalo,https://www.prothomalo.com/business/092x597f4h,পেঁয়াজ রপ্তানিতে নিষেধাজ্ঞা দিল ভারত,ভারত আগামী বছরের ৩১ মার্চ পর্যন্ত পেঁয়াজ রপ্তানিতে নিষেধাজ্ঞা আরোপ করেছে।,India bans onion export,India has imposed a ban on onion exports till March 31 next year.,Education,https://images.prothomalo.com/prothomalo-bangla%2F2023-06%2F5fa5ec02-baf6-416e-a280-f0ce75cc0c50%2FONION.jpg?rect=0%2C0%2C480%2C252&w=1200&ar=40%3A21&auto=format%2Ccompress&ogImage=true&mode=crop&overlay=https%3A%2F%2Fimages.prothomalo.com%2Fprothomalo-bangla%2F2022-01%2F18c58c05-9e66-46f3-8946-4437460f8f90%2FBanner_7814X143.jpg&overlay_position=bottom&overlay_width_pct=1
2023-12-09,prothomalo,https://www.prothomalo.com/world/south-america/dyingaot7f,সংখ্যাগরিষ্ঠের সমর্থন কোনোমতে টিকিয়ে রেখেছে লুলার সরকার: জরিপ,"ডাটাফোলহার জরিপে দেখা গেছে, তৃতীয় মেয়াদে প্রেসিডেন্ট হওয়ার প্রথম বছর শেষে বামপন্থী এ প্রেসিডেন্টকে সমর্থন দিচ্ছেন ৩৮ শতাংশ মানুষ।",Lula's government retains majority support: poll,"According to Datafolher's survey, 38 percent of people support the left-wing president after the first year of his third term.",Environment,https://images.prothomalo.com/prothomalo-bangla%2F2023-12%2F831a9be4-60e1-4ea7-b499-188784778b0f%2FLula.jpg?rect=0%2C0%2C857%2C450&w=1200&ar=40%3A21&auto=format%2Ccompress&ogImage=true&mode=crop&overlay=https%3A%2F%2Fimages.prothomalo.com%2Fprothomalo-bangla%2F2022-01%2F5a36c819-05a2-4bfb-ac50-57dd67355acb%2FBanner_7814X143.jpg&overlay_position=bottom&overlay_width_pct=1
2023-12-09,prothomalo,https://www.prothomalo.com/politics/i1wbfgo2qe,"কামরুলের আয় বেড়েছে ২৮ গুণ, সম্পদ ৫৫ গুণ",নবম সংসদ নির্বাচনের আগে কামরুল ইসলামের অস্থাবর সম্পদের পরিমাণ ছিল ৮ লাখ ৫৫ হাজার টাকা।,"Kamrul's income increased 28 times, assets 55 times","Before the ninth parliamentary election, the amount of movable property of Kamrul Islam was 8 lakh 55 thousand taka.",Sports,https://images.prothomalo.com/prothomalo-bangla%2F2023-12%2F46317d55-6b54-4d52-ae06-3a92479acfcf%2FKAMRUL_ISLAM102053.JPG?rect=0%2C5%2C450%2C236&w=1200&ar=40%3A21&auto=format%2Ccompress&ogImage=true&mode=crop&overlay=https%3A%2F%2Fimages.prothomalo.com%2Fprothomalo-bangla%2F2022-01%2F5a36c819-05a2-4bfb-ac50-57dd67355acb%2FBanner_7814X143.jpg&overlay_position=bottom&overlay_width_pct=1
2023-12-09,prothomalo,https://www.prothomalo.com/entertainment/bollywood/p1e64uynoe,মা–বাবাই সুহানার বড় প্রেরণা,বলিউড অভিষেকের আগে কী বললেন সুহানা,Parents are Suhana's biggest motivation,What did Suhana say before her Bollywood debut?,Sports,https://images.prothomalo.com/prothomalo-bangla%2F2023-12%2Fef53a322-e178-4513-9056-478ba19fe442%2F338764129_598926771904080_178816739858749677_n.jpg?rect=0%2C0%2C1350%2C709&w=1200&ar=40%3A21&auto=format%2Ccompress&ogImage=true&mode=crop&overlay=https%3A%2F%2Fimages.prothomalo.com%2Fprothomalo-bangla%2F2023-10%2Fae7d5c90-d7c9-4623-8d67-1fff8bde16af%2FGPI_2_7814X543.jpg&overlay_position=bottom&overlay_width_pct=1
2023-12-09,prothomalo,https://www.prothomalo.com/bangladesh/district/6hpmg8ohur,‘নৌকাওয়ালারা পালানোর জন্য জায়গা পাবে না’ বলা আওয়ামী লীগ নেতাকে শোকজ,সিরাজুল ইসলাম মাধবদী থানা আওয়ামী লীগের আহ্বায়ক। নোটিশ পাওয়ার দুই দিনের মধ্যে সহকারী রিটার্নিং কর্মকর্তার কার্যালয়ে তাঁকে লিখিতভাবে কারণ দর্শানোর জন্য বলা হয়েছে।,The Awami League leader said that 'boatmen will not get a place to escape',Sirajul Islam Madhavadi Thana Awami League convener. He has been asked to show cause in writing in the office of the Assistant Returning Officer within two days of receiving the notice.,Politics,https://images.prothomalo.com/prothomalo-bangla%2F2023-12%2F2102a7b7-657b-4bed-8d4b-1bdf0cb3ee18%2FSYLHET_DH0720_20231207_NARSINGDI_MADHABDI_SPECH_VIRAL_SIRAJIL_ISLAM_JPG.JPG?rect=0%2C0%2C945%2C496&w=1200&ar=40%3A21&auto=format%2Ccompress&ogImage=true&mode=crop&overlay=&overlay_position=bottom&overlay_width_pct=1
2023-12-09,prothomalo,https://www.prothomalo.com/politics/9h1e2niigt,আশ্বাসে নির্বাচনে যাচ্ছে জাতীয় পার্টি,"নির্বাচন সামনে রেখে আসন-ভাগাভাগি বা সমঝোতার বিষয়ে ১৪-দলীয় জোটের শরিক, এমনকি জাতীয় পার্টির সঙ্গেও আলোচনা করছে আওয়ামী লীগ।",Jatiya Party is going to the election with assurance,Awami League is discussing with the 14-party alliance partners and even the Jatiya Party regarding seat-sharing or compromise ahead of the elections.,Health,https://images.prothomalo.com/prothomalo-bangla%2F2023-12%2F30e1e05d-a715-4669-adb4-70a2a9f48b24%2F094351092046CHUNNU105115.JPG?w=1200&ar=40%3A21&auto=format%2Ccompress&ogImage=true&mode=crop&overlay=https%3A%2F%2Fimages.prothomalo.com%2Fprothomalo-bangla%2F2022-01%2F5a36c819-05a2-4bfb-ac50-57dd67355acb%2FBanner_7814X143.jpg&overlay_position=bottom&overlay_width_pct=1
2023-12-09,prothomalo,https://www.prothomalo.com/world/middle-east/a87kolgn2x,গাজায় ইসরায়েলের হামলার দুই মাসে কী ঘটল,৭ অক্টোবর হামাসের হামলার জবাবে সেদিন থেকেই গাজা উপত্যকায় হামলা শুরু করে ইসরায়েল।,What happened two months into Israel's attack on Gaza?,"In response to the attack by Hamas on October 7, Israel began attacking the Gaza Strip from that day.",World,https://images.prothomalo.com/prothomalo-bangla%2F2023-12%2Fed93c584-9c26-4a79-8d14-7bb9ad7f8e30%2FUntitled_1.jpg?rect=0%2C42%2C770%2C404&w=1200&ar=40%3A21&auto=format%2Ccompress&ogImage=true&mode=crop&overlay=&overlay_position=bottom&overlay_width_pct=1
2023-12-09,prothomalo,https://nagorik.prothomalo.com/durporobash/t9j0i0k4yn,নিকলাসের দিন-রাত্রি,"হাতে এক পেগ রাম নিয়ে নিকলাস রডমান অ্যাপার্টমেন্টের বেলকনিতে বসে কাচের জানালা দিয়ে বাইরের তাকিয়ে ছিল। নিকলাসের অ্যাপার্টমেন্ট ছয়তালায়, ঘরের ভেতর লাইট নেভানো।",Nicholas day and night,"With a peg rum in hand, Nicklas Rodman was sitting on the balcony of his apartment looking out through the glass window. Nicholas's apartment is on the sixth floor, the lights are off.",Business,https://images.prothomalo.com/prothomalo-bangla%2F2023-09%2F6288ca59-a890-49a9-9bdb-69d9a952e5a8%2F1bd9b118464d64a0f83e1e4f121cce9f_Untitled_10.jpg?rect=0%2C0%2C600%2C315&w=1200&ar=40%3A21&auto=format%2Ccompress&ogImage=true&mode=crop&overlay=https%3A%2F%2Fimages.prothomalo.com%2Fprothomalo-bangla%2F2022-05%2Fe0cb6603-480f-4ea2-9615-3cdbb5c9ff75%2FGPI.jpg&overlay_position=bottom&overlay_width_pct=1
2023-12-09,prothomalo,https://www.prothomalo.com/sports/cricket/796puik4n3,"গম্ভীরের সমালোচনা করে ভিডিও, আইনি নোটিশ পেলেন শ্রীশান্ত","২০১৩ সালে আইপিএলে স্পট ফিক্সিংয়ের দায়ে রাজস্থান রয়্যালসের তিন খেলোয়াড়কে নিষিদ্ধ করা হয়েছিল, শ্রীশান্ত তাঁদের একজন। ২০১৯ সালে এসে সুপ্রিম কোর্ট শ্রীশান্তের নিষেধাজ্ঞা বাতিল করেন।","Video criticizing Gambhir, Sreesanth gets legal notice","In 2013, three Rajasthan Royals players were banned for spot-fixing in the IPL, Sreesanth being one of them. In 2019, the Supreme Court canceled Sreesanth's ban.",Politics,https://images.prothomalo.com/prothomalo-bangla%2F2023-12%2Fb178f08a-f053-45f4-b7cb-16218d71c088%2Fsreesanth.webp?rect=0%2C0%2C1200%2C630&w=1200&ar=40%3A21&auto=format%2Ccompress&ogImage=true&mode=crop&overlay=https%3A%2F%2Fimages.prothomalo.com%2Fprothomalo-bangla%2F2023-10%2Fae7d5c90-d7c9-4623-8d67-1fff8bde16af%2FGPI_2_7814X543.jpg&overlay_position=bottom&overlay_width_pct=1
2023-12-09,prothomalo,https://www.prothomalo.com/world/usa/wcjyooba8a,ইসরায়েলের কড়া সমালোচনা করলেন ব্লিঙ্কেন,বৃহস্পতিবার মার্কিন প্রেসিডেন্ট জো বাইডেনও আলাদা করে ইসরায়েলি প্রধানমন্ত্রী বেনিয়ামিন নেতানিয়াহু ও জর্ডানের বাদশাহ আবদুল্লাহর সঙ্গে ফোনে কথা বলেছেন।,Blinken strongly criticized Israel,"On Thursday, US President Joe Biden also spoke separately with Israeli Prime Minister Benjamin Netanyahu and Jordanian King Abdullah on the phone.",Environment,https://images.prothomalo.com/prothomalo-bangla%2F2023-12%2F70a157bd-1a9f-447d-a753-ec027238fded%2FBlinken.jpeg?rect=0%2C0%2C1200%2C630&w=1200&ar=40%3A21&auto=format%2Ccompress&ogImage=true&mode=crop&overlay=https%3A%2F%2Fimages.prothomalo.com%2Fprothomalo-bangla%2F2022-01%2F5a36c819-05a2-4bfb-ac50-57dd67355acb%2FBanner_7814X143.jpg&overlay_position=bottom&overlay_width_pct=1
2023-12-09,kishoralo,https://www.kishoralo.com/other/9r2fbq5pdd,সাপটি কতটুকু লম্বা?,সত্যিই একটি বিশাল সাপকে গাছে উঠতে দেখা যাচ্ছে। সাপটির অর্ধেক এখনো গাছে ওঠেনি। বাকি অর্ধেকের দুই-তৃতীয়াংশ গাছের সঙ্গে পেঁচিয়ে আছে।,How long is the snake?,A really huge snake is seen climbing the tree. Half of the snake has not yet climbed the tree. Two-thirds of the other half is twisted with the tree.,World,https://images.prothomalo.com/prothomalo-bangla%2F2023-12%2F5082c13e-030d-4548-9037-5aa27013230c%2F1.jpg?rect=0%2C30%2C1600%2C840&w=1200&ar=40%3A21&auto=format%2Ccompress&ogImage=true&mode=crop&overlay=https%3A%2F%2Fimages.prothomalo.com%2Fprothomalo-bangla%2F2021-06%2Fbe2d99ee-c039-4acf-a6fb-2356c69a08a6%2FKIA_OG_watermark_final.png&overlay_position=bottom&overlay_width_pct=1
2023-12-09,prothomalo,https://www.prothomalo.com/bangladesh/district/534fnzq6rf,"দুবাই থেকে সিলেটে আসা ফ্লাইটে বিপুল সোনা, জড়িত ৪ যাত্রী",সিলেটের এম এ জি ওসমানী আন্তর্জাতিক বিমানবন্দরে বিপুল পরিমাণ সোনা জব্দ করেছে শুল্ক গোয়েন্দা ও বিমানবন্দর কাস্টমস।,"Huge amount of gold in the flight from Dubai to Sylhet, 4 passengers involved",Customs intelligence and airport customs have seized a huge amount of gold at MAG Osmani International Airport in Sylhet.,Politics,https://images.prothomalo.com/prothomalo-bangla%2F2023-12%2Fdd983ba6-9adb-44a0-be56-a7a8a07e1002%2FSylhet_DH0486_20231208_Sylelhet_gold_1.jpg?w=1200&ar=40%3A21&auto=format%2Ccompress&ogImage=true&mode=crop&overlay=&overlay_position=bottom&overlay_width_pct=1
2023-12-09,prothomalo,https://www.prothomalo.com/bangladesh/environment/01m26zmdzy,গাংচষাদের পিছে ঘোরাঘুরি,নূর ইসলাম পদ্মা নদীতে বহুদিনের পাখি দেখার সাথি। পদ্মায় পাখি দেখার অনেক খবরই তাঁর কাছ থেকে পাই।,Wandering behind Gangchashad,Noor Islam is a long time bird watcher in the Padma River. I got a lot of news about bird sightings in Padma from him.,Sports,https://images.prothomalo.com/prothomalo-bangla%2F2023-12%2F06a6ff62-39cc-41cc-b349-49198626c241%2FUntitled_4.jpg?rect=0%2C129%2C736%2C386&w=1200&ar=40%3A21&auto=format%2Ccompress&ogImage=true&mode=crop&overlay=&overlay_position=bottom&overlay_width_pct=1
2023-12-09,prothomalo,https://www.prothomalo.com/bangladesh/district/v399fzn0tv,আচরণবিধি ভেঙে গ্রামে গ্রামে ভোট চাইছেন নৌকার শাহজাহান,দ্বাদশ জাতীয় সংসদ নির্বাচনে ব্রাহ্মণবাড়িয়া-২ (সরাইল-আশুগঞ্জ) আসনে আওয়ামী লীগের প্রার্থী সদ্য নির্বাচিত সংসদ সদস্য শাহজাহান আলমকে আচরণবিধি লঙ্ঘন করে নির্বাচনী প্রচারণা চালাতে দেখা গেছে।,Shahjahan of the boat is seeking votes in villages breaking the code of conduct,"Awami League candidate for Brahmanbaria-2 (Sarail-Ashuganj) Constituency in the 12th National Assembly Election, newly elected Member of Parliament Shahjahan Alam was found to be campaigning in violation of the code of conduct.",Science,https://images.prothomalo.com/prothomalo-bangla%2F2023-12%2F6d109e36-d59d-4548-9a71-35d25fa027cb%2F408705511_6908974445889282_8575936434982755049_n.jpg?rect=0%2C30%2C1600%2C840&w=1200&ar=40%3A21&auto=format%2Ccompress&ogImage=true&mode=crop&overlay=&overlay_position=bottom&overlay_width_pct=1
2023-12-09,prothomalo,https://www.prothomalo.com/education/study/8c6n0xtjt9,ইংরেজি প্রশ্নোত্তর - (৬৬) | ক্যাডেট কলেজে ৭ম শ্রেণিতে ভর্তি প্রস্তুতি ২০২৪,,English Question and Answer - (66) | Cadet College 7th Class Admission Preparation 2024,,Education,https://images.prothomalo.com/prothomalo-bangla%2F2023-12%2F59ede8d8-46ba-4e53-a7d9-104b7bfcdd98%2F67__cadet_college_admission_prep_13__1_.jpg?rect=0%2C30%2C1601%2C841&w=1200&ar=40%3A21&auto=format%2Ccompress&ogImage=true&mode=crop&overlay=https%3A%2F%2Fimages.prothomalo.com%2Fprothomalo-bangla%2F2022-01%2F5a36c819-05a2-4bfb-ac50-57dd67355acb%2FBanner_7814X143.jpg&overlay_position=bottom&overlay_width_pct=1
2023-12-09,prothomalo,https://www.prothomalo.com/chakri/employment/f3uthk7bpx,"অক্সফামে চাকরি, বছরে বেতন ১৪ লাখ ৬২ হাজার",আন্তর্জাতিক দাতব্য সংস্থা অক্সফাম ঢাকায় ক্লাইমেট জাস্টিস অ্যান্ড ন্যাচারাল রিসোর্স রাইটস (সিজেএনআরআর) টিমে সিনিয়র সফটওয়্যার ডেভেলপার পদে কর্মী নিয়োগ দেবে।,"Oxfam job, annual salary 14 lakh 62 thousand",International charity Oxfam will hire a senior software developer for its Climate Justice and Natural Resource Rights (CJNRR) team in Dhaka.,Sports,https://images.prothomalo.com/prothomalo-bangla%2F2022-11%2Fc875fd29-7b7b-4b22-a7bd-5dd4d4808f7f%2F251A2104.JPG?rect=0%2C0%2C6720%2C3528&w=1200&ar=40%3A21&auto=format%2Ccompress&ogImage=true&mode=crop&overlay=https%3A%2F%2Fimages.prothomalo.com%2Fprothomalo-bangla%2F2022-01%2F18c58c05-9e66-46f3-8946-4437460f8f90%2FBanner_7814X143.jpg&overlay_position=bottom&overlay_width_pct=1
