date,website,url,title,text,translated_title,translated_text,category,main_image
2023-12-09,kalerkantho,https://www.kalerkantho.com/print-edition/first-page/2023/12/08/1343847,১৩ দেশের ৩৭ ব্যক্তির ওপর মার্কিন নিষেধাজ্ঞা,১৩ দেশের ৩৭ ব্যক্তির ওপর মার্কিন নিষেধাজ্ঞা,US sanctions on 37 individuals from 13 countries,US sanctions on 37 individuals from 13 countries,Science,https://cdn.kalerkantho.com/files/shares/default-img.jpg
2023-12-09,kalerkantho,https://www.kalerkantho.com/print-edition/first-page/2023/12/08/1343848,মানবাধিকার দিবসে মাঠে নামবে বিএনপি,মানবাধিকার দিবসে মাঠে নামবে বিএনপি,BNP will enter the field on Human Rights Day,BNP will enter the field on Human Rights Day,Education,http://cdn.kalerkantho.com/public/news_images/2023/12/09/1702065653-aa7306c81f557a9228b4a0fb4001a96f.jpg
2023-12-09,kalerkantho,https://www.kalerkantho.com/print-edition/news/2023/12/08/1343849,বাংলাদেশ অযৌক্তিক রাজনৈতিক চাপের মুখোমুখি হচ্ছে,"জাতীয় সংসদ নির্বাচন ঘিরে বাংলাদেশ বিভিন্ন মহল থেকে অযাচিত, অযৌক্তিক রাজনৈতিক চাপের মুখোমুখি হচ্ছে বলে অভিযোগ করেছেন পররাষ্ট্রমন্ত্রী এ কে আব্দুল মোমেন",Bangladesh is facing undue political pressure,Foreign Minister AK Abdul Momen has alleged that Bangladesh is facing unwanted and unreasonable political pressure from various quarters around the National Assembly elections.,Technology,http://cdn.kalerkantho.com/public/news_images/2023/12/09/1702065036-55e6b66b383945a7efb016d5633cce1f.jpg
2023-12-09,kalerkantho,https://www.kalerkantho.com/print-edition/news/2023/12/08/1343850,দেশে ফেরার অপেক্ষায় ভারতে পাচার কিশোরী,সাড়ে পাঁচ মাস আগে ভারতে পাচার হওয়া এক বাংলাদেশি কিশোরীকে ফিরিয়ে আনার প্রক্রিয়া চলছে,Trafficked girls in India waiting to return home,The process of bringing back a Bangladeshi girl who was trafficked to India five and a half months ago is underway,Entertainment,https://cdn.kalerkantho.com/files/shares/default-img.jpg
2023-12-09,kalerkantho,https://www.kalerkantho.com/print-edition/last-page/2023/12/08/1343851,দুঃস্বপ্ন গ্রাস করেছে গাজাকে,দুঃস্বপ্ন গ্রাস করেছে গাজাকে,Nightmare engulfs Gaza,Nightmare engulfs Gaza,Entertainment,http://cdn.kalerkantho.com/public/news_images/2023/12/09/1702065334-63f9418244fe3f77ffcc12061b2e6ba4.jpg
2023-12-09,kalerkantho,https://www.kalerkantho.com/print-edition/last-page/2023/12/08/1343852,নৌকা নিয়েই এক জাদুঘর,নৌকা নিয়েই এক জাদুঘর,A museum with boats,A museum with boats,Health,http://cdn.kalerkantho.com/public/news_images/2023/12/09/1702065380-0aac3202c0749437d7a0a038dad9e247.jpg
2023-12-09,kalerkantho,https://www.kalerkantho.com/print-edition/last-page/2023/12/08/1343853,"প্রশ্নপত্র ফাঁসচেষ্টা, গ্রেপ্তার ১১৩","প্রশ্নপত্র ফাঁসচেষ্টা, গ্রেপ্তার ১১৩","Attempted question paper leak, arrest 113","Attempted question paper leak, arrest 113",Science,http://cdn.kalerkantho.com/public/news_images/2023/12/09/1702065411-29f053c03966327e578e99e28643fd5c.jpg
2023-12-09,kalerkantho,https://www.kalerkantho.com/print-edition/last-page/2023/12/08/1343854,ক্যান্সার আক্রান্ত মা ও স্কুলছাত্রীকে সহায়তা,বাংলাদেশকে ৪০ কোটি ডলার দিচ্ছে এডিবি,Support for mothers and school children with cancer,ADB is giving 40 million dollars to Bangladesh,Science,https://cdn.kalerkantho.com/files/shares/default-img.jpg
2023-12-09,kalerkantho,https://www.kalerkantho.com/print-edition/last-page/2023/12/08/1343855,লবিস্টের ভিড়ে ক্ষতিগ্রস্তদের কণ্ঠ চাপা পড়েছে,লবিস্টের ভিড়ে ক্ষতিগ্রস্তদের কণ্ঠ চাপা পড়েছে,The voices of the victims have been drowned out by the crowd of lobbyists,The voices of the victims have been drowned out by the crowd of lobbyists,Environment,http://cdn.kalerkantho.com/public/news_images/2023/12/09/1702065460-16db4250b913740d5c3ca98454252cc0.jpg
2023-12-09,kalerkantho,https://www.kalerkantho.com/print-edition/last-page/2023/12/08/1343856,,,,,Politics,
2023-12-09,kalerkantho,https://www.kalerkantho.com/print-edition/last-page/2023/12/08/1343857,লোকসভার পদ হারালেন মহুয়া,লোকসভার পদ হারালেন মহুয়া,Mahua lost the post of Lok Sabha,Mahua lost the post of Lok Sabha,Technology,http://cdn.kalerkantho.com/public/news_images/2023/12/09/1702065527-ed5ef83cfeee0cb13dd2e5d7b26310f5.jpg
2023-12-09,kalerkantho,https://www.kalerkantho.com/print-edition/last-page/2023/12/08/1343858,রাস্তায় আয়োজিত ফ্যাশন শো,রাস্তায় আয়োজিত ফ্যাশন শো,Street fashion show,Street fashion show,Education,http://cdn.kalerkantho.com/public/news_images/2023/12/09/1702065548-61c5775f0e62599c795e831b7ae06558.jpg
2023-12-09,kalerkantho,https://www.kalerkantho.com/print-edition/last-page/2023/12/08/1343859,বাঁকা চোখে,বাঁকা চোখে,crooked eyes,crooked eyes,Environment,http://cdn.kalerkantho.com/public/news_images/2023/12/09/1702065573-4fd55bfeef5e65c82a1d0e3e7065e590.jpg
2023-12-09,kalerkantho,https://www.kalerkantho.com/online/national/2023/12/08/1343860,,,,,Politics,
2023-12-09,kalerkantho,https://www.kalerkantho.com/online/country-news/2023/12/08/1343861,"মোটরসাইকেল নিয়ন্ত্রণ হারিয়ে তালগাছে ধাক্কা, যুবক নিহত",নওগাঁর মহাদেবপুরে মোটরসাইকেল নিয়ন্ত্রণ হারিয়ে তালগাছের সঙ্গে ধাক্কা লেগে তারেক হোসেন (১৮) নামে এক যুবক নিহত হয়েছেন।,"The motorcycle lost control and hit a palm tree, the youth was killed","A young man named Tarek Hossain (18) was killed after losing control of his motorcycle and hitting a palm tree in Mahadevpur, Naogaon.",Sports,http://cdn.kalerkantho.com/public/news_images/2023/12/09/1702067692-b0ef055cc25eb4476685b7662023d0b3.jpg
2023-12-09,kalerkantho,https://www.kalerkantho.com/online/dhaka/2023/12/08/1343862,মায়ের ওপর অভিমান করে স্কুলছাত্রীর আত্মহত্যা,রাজধানীর কামরাঙ্গীর চরে এক স্কুলছাত্রী গলায় ফাঁস দিয়ে আত্মহত্যা করেছে।,Schoolgirl committed suicide by insulting her mother,A schoolgirl committed suicide by hanging herself in Kamrangir Char of the capital.,Education,http://cdn.kalerkantho.com/public/news_images/2023/12/09/1702069410-b0ef055cc25eb4476685b7662023d0b3.jpg
2023-12-09,kalerkantho,https://www.kalerkantho.com/online/country-news/2023/12/08/1343863,বেগম রোকেয়া দিবস আজ,বেগম রোকেয়ার জন্মভূমি রংপুরের মিঠাপুকুর উপজেলার পায়রাবন্দ গ্রাম।,Today is Begum Rokeya Day,Begum Rokeya's birth place is Payaraband village of Mithapukur upazila of Rangpur.,Education,http://cdn.kalerkantho.com/public/news_images/2023/12/09/og/1702071313-c9473bcdbfc31634a6e23872935da3b9.jpg
2023-12-09,kalerkantho,https://www.kalerkantho.com/online/Politics/2023/12/08/1343864,রবিবার মানবাধিকার দিবসে মাঠে নামবে বিএনপি,"সরকারবিরোধী চলমান আন্দোলনে দলের নেতাকর্মীদের গ্রেপ্তার, মামলা, সাজা দেওয়া এবং কারা ও পুলিশ হেফাজতে নির্যাতন",BNP will enter the field on Human Rights Day on Sunday,"Arrests, prosecutions, sentencing and torture of party leaders and activists in prison and police custody in the ongoing anti-government movement",Education,http://cdn.kalerkantho.com/public/news_images/2023/12/09/1702072348-17305b64283d8b6267edc7b8e3df002e.jpg
2023-12-09,kalerkantho,https://www.kalerkantho.com/online/country-news/2023/12/08/1343865,"ঠাকুরগাঁওয়ে শিক্ষক নিয়োগ পরীক্ষায় ডিভাইস জালিয়াতি, আটক ৯",ঠাকুরগাঁওয়ে সহকারী প্রাথমিক শিক্ষক নিয়োগ প্রথম ধাপের পরীক্ষা শুক্রবার ৮ ডিসেম্বর সকাল ১০টায় জেলার ৩৪টি পরীক্ষা কেন্দ্রে অনুষ্ঠিত হয়।,"Device fraud in teacher recruitment exam in Thakurgaon, 9 arrested",Thakurgaon assistant primary teacher recruitment first phase examination was held on Friday December 8 at 10 am in 34 examination centers of the district.,Health,http://cdn.kalerkantho.com/public/news_images/2023/12/09/1702074081-22ffef2e2ae9e372526672539c107db3.jpg
2023-12-09,kalerkantho,https://www.kalerkantho.com/online/country-news/2023/12/08/1343866,,,,,World,
2023-12-09,kalerkantho,https://www.kalerkantho.com/online/country-news/2023/12/08/1343867,,,,,Entertainment,
2023-12-09,kalerkantho,https://www.kalerkantho.com/online/business/2023/12/09/1343868,বাংলাদেশকে ৪০ কোটি ডলার ঋণ দিচ্ছে এডিবি,জলবায়ু পরিবর্তনের কারণে বছরে বাংলাদেশের ৩০০ কোটি ডলারের বেশি ক্ষতি হয়। এই ক্ষতি মোকাবেলায় বাংলাদেশের জন্য ৪০ কোটি ডলারের বা চার হাজার ৩৯৩ কোটি,ADB is giving a loan of 40 million dollars to Bangladesh,Bangladesh is losing more than 3 billion dollars annually due to climate change. 40 million dollars or four thousand 393 crores for Bangladesh to deal with this loss,Health,http://cdn.kalerkantho.com/public/news_images/2023/12/09/og/1702087552-06272124379062965b41623e8f9575ed.jpg
2023-12-09,kalerkantho,https://www.kalerkantho.com/online/national/2023/12/09/1343869,সৌদি যাওয়া কর্মীদের ৪৯ শতাংশ ফেরত আসছে দেশে,"সরকারি হিসাবে চলতি বছরের ১১ মাসে সৌদি আরবে গেছেন চার লাখ ৫১ হাজার ৫০২ জন কর্মী। আর অভিবাসন গবেষণা সংস্থা রামরুর হিসাবে, সৌদি আরবে প্রতি মাসে যত কর্মী যান",49 percent of the workers who went to Saudi are returning to the country,"According to the government, 4 lakh 51 thousand 502 workers went to Saudi Arabia in 11 months of this year. And according to migration research firm Ramrur, as many workers go to Saudi Arabia every month",Science,http://cdn.kalerkantho.com/public/news_images/2023/12/09/og/1702088287-e06d061a77a7bde916b8a91163029d41.jpg
2023-12-09,kalerkantho,https://www.kalerkantho.com/online/country-news/2023/12/09/1343870,অসচ্ছলদের চাল যাচ্ছে সচ্ছলদের ব্যাগে,দুর্দিন কাটাতে সহযোগিতার জন্য ছুটেছেন জনপ্রতিনিধিদের কাছে।,Rice of the poor goes to the bag of the rich,He rushed to the public representatives for help to overcome the hardships.,Environment,http://cdn.kalerkantho.com/public/news_images/2023/12/09/og/1702088797-1480a59934a284b83b84861c345d44d6.jpg
2023-12-09,kalerkantho,https://www.kalerkantho.com/online/sport/2023/12/09/1343871,ওল্ড ট্রাফোর্ডে উড়ে গেল ম্যানচেস্টার ইউনাইটেড,"সংবাদ সম্মেলন শেষ করেই ভোঁ-দৌড় দিলেন নাঈম হাসান। কিসের এত তাড়া নাঈমের? বাংলাদেশ দলের ম্যানেজার নাফিস ইকবাল জানালেন, টিম বাস তাঁর জন্য",Manchester United flew to Old Trafford,"After the press conference, Naeem Hasan ran away. Why is Naeem in such a hurry? Bangladesh team manager Nafis Iqbal said that the team bus is for him",Technology,http://cdn.kalerkantho.com/public/news_images/2023/12/09/og/1702088899-7c10b8c5de46cb1b8418a56c385976f8.jpg
2023-12-09,kalerkantho,https://www.kalerkantho.com/online/entertainment/2023/12/09/1343872,‘মেকআপ ফ্ল্যাশব্যাক’ নিয়ে যা জানালেন রুনা খান,এই প্রতিবেদনের সঙ্গে অভিনেত্রী রুনা খানের ছবিটা ভালো করে দেখুন। কোনো অসংগতি চোখে পড়ছে? কিন্তু এই একই মেকআপ ও সাজসজ্জায় ‘ছিটকিনি’ অভিনেত্রী যখন দাঁড়িয়েছিলেন,What Runa Khan told about 'makeup flashback',"Check out the picture of actress Runa Khan with this report. Notice any inconsistencies? But in this same makeup and outfit, the 'Chitkini' actress stood out",Politics,http://cdn.kalerkantho.com/public/news_images/2023/12/09/og/1702089351-7151184986aed9f8f418938930271d37.jpg
2023-12-09,kalerkantho,https://www.kalerkantho.com/online/world/2023/12/09/1343873,গাজাকে গ্রাস করেছে দুঃস্বপ্ন,গত বশ কয়েক মেয়াদের কোনো মহাসচিব এ উদ্যোগ নেননি।,Nightmare engulfs Gaza,No Secretary General of the last five years has taken this initiative.,Health,http://cdn.kalerkantho.com/public/news_images/2023/12/09/og/1702089832-6ce33cd00c7fbf92491be06e50a052aa.jpg
2023-12-09,kalerkantho,https://www.kalerkantho.com/online/world/2023/12/09/1343874,"তাইওয়ানের আকাশে চীনা বেলুন, ১২ যুদ্ধবিমান",চীনের ১২টি যুদ্ধবিমান ও একটি বেলুন তাইওয়ান প্রণালির মধ্যরেখা অতিক্রম করার অভিযোগ করেছে তাইওয়ান। স্বশাসিত দ্বীপদেশটিতে প্রেসিডেন্ট নির্বাচনের প্রায় এক মাস আগে,"Chinese balloons in the sky of Taiwan, 12 warplanes",Taiwan has accused 12 Chinese warplanes and a balloon of crossing the middle line of the Taiwan Strait. It's about a month before the presidential election in the self-governing island nation,World,http://cdn.kalerkantho.com/public/news_images/2023/12/09/og/1702090053-7151184986aed9f8f418938930271d37.jpg
2023-12-09,kalerkantho,https://www.kalerkantho.com/online/miscellaneous/2023/12/09/1343875,রাস্তায় আয়োজিত ফ্যাশন শো,"যুক্তরাজ্যের ম্যানচেস্টার শহরের একটি রাস্তায় হয়ে গেলে বিচিত্র ফ্যাশন শো। গত বৃহস্পতিবার এ উপলক্ষে সেখানে ভিড় জমিয়েছেন বিভিন্ন দেশের সেলিব্রিটি, মডেল",Street fashion show,"A unique fashion show takes place on a street in Manchester, UK. On this occasion last Thursday, celebrities and models from different countries gathered there",Entertainment,http://cdn.kalerkantho.com/public/news_images/2023/12/09/og/1702090580-dcab94a96bb7c077b87945a031ee6eb7.jpg
2023-12-09,kalerkantho,https://www.kalerkantho.com/online/world/2023/12/09/1343876,ক্ষতিগ্রস্তদের কণ্ঠ চাপা পড়ে যাচ্ছে লবিস্টের ভিড়ে,টোটালএনার্জিস ও নরওয়ের ইকুইনরের মতো বিপুলসংখ্যক দূষণকারী কম্পানির প্রতিনিধিরাও রয়েছেন।,The voices of the victims are being drowned out by the crowd of lobbyists,There are also representatives of large polluting companies such as TotalEnergies and Norway's Equinor.,Business,http://cdn.kalerkantho.com/public/news_images/2023/12/09/og/1702090966-fee4e47f3e4c529b1f2c751035a4492c.gif
2023-12-09,kalerkantho,https://www.kalerkantho.com/online/miscellaneous/2023/12/09/1343877,ভিন্নধর্মী দর্শনীয় স্থান ‘বঙ্গবন্ধু নৌকা জাদুঘর’,বরগুনা শহরে এক ভিন্নধর্মী দর্শনীয় স্থান ‘বঙ্গবন্ধু নৌকা জাদুঘর’। বিলুপ্ত এবং এখনো প্রচলিত শতাধিক রকমের নৌকা বা মডেল রয়েছে এই জাদুঘরে।,Different attractions 'Bangabandhu Boat Museum',"Bangabandhu Boat Museum is a unique attraction in Barguna town. There are hundreds of types of boats or models, extinct and still in use, in this museum.",Politics,http://cdn.kalerkantho.com/public/news_images/2023/12/09/og/1702091634-d9c836c578f36983108ad3f36f31ff76.jpg
2023-12-09,kalerkantho,https://www.kalerkantho.com/online/world/2023/12/09/1343878,ঘুষ নেওয়ার অভিযোগ: লোকসভার পদ হারালেন মহুয়া,"লোকসভা ভোটের আগে মাত্র একটি অধিবেশন বাকি থাকতে বহিষ্কৃত হওয়ার পর সংসদের বাইরে মহুয়া মৈত্র জানিয়েছেন, এই ঘটনার শেষ দেখে ছাড়বেন।",Allegation of bribery: Mahua lost Lok Sabha post,"After being expelled with just one session left before the Lok Sabha polls, Mahua Maitra said outside Parliament that she would see the end of the incident.",Science,http://cdn.kalerkantho.com/public/news_images/2023/12/09/og/1702091694-ea2c33f007e33bf09ca81a920a60e7f7.gif
2023-12-09,kalerkantho,https://www.kalerkantho.com/online/national/2023/12/09/1343879,"ছোট হয়ে এসেছে শীতকাল, তুলনামূলক বেশি থাকবে তাপমাত্রা",শীতকালের স্থায়িত্ব বা ব্যাপ্তি অন্যান্যবারের তুলনায় এবার কিছুটা কম হতে পারে। শীত মৌসুমে অন্যান্য বছরের তুলনায় তাপমাত্রাও কিছুটা বেশি থাকতে পারে।,"Winter is short, the temperature will be relatively high",The duration or extent of winter may be a little less this time than at other times. The temperature may also be slightly higher during the winter season than other years.,Education,http://cdn.kalerkantho.com/public/news_images/2023/12/09/og/1702092109-837d65defe2af277347321ba0c825e59.jpg
2023-12-09,kalerkantho,https://www.kalerkantho.com/online/sport/2023/12/09/1343880,পাহাড়ে ফুল ফোটান তিনি,"ডানপিটে ছিলেন। স্কুল থেকে ফিরে বই-খাতা রেখেই ছুটতেন মাঠে। ক্রিকেটের নেশা যেন পেয়ে বসেছিল। নাওয়াখাওয়া বাদ। খেলার জন্য বাবার পিটুনি, মায়ের বকুনিও কম খাননি।",He blooms on the mountain,"He was on the right. After returning from school, he used to run in the field with his books and notebooks. He was addicted to cricket. Avoid eating. Father's beating for playing, mother's scolding did not eat less.",Technology,http://cdn.kalerkantho.com/public/news_images/2023/12/09/og/1702092568-4fc8d3856a7978cc71fe6bc2634e034c.jpg
2023-12-09,kalerkantho,https://www.kalerkantho.com/online/lifestyle/2023/12/09/1343881,কিডনির পাথর প্রতিরোধের উপায়,"কিডনির পাথর বেরিয়ে গেলেও আবার হওয়ার আশঙ্কা থাকে। তাই যাঁদের একবার পাথর হয়েছে, তাঁদের কিছু পরামর্শ মেনে চলতে হবে।",Ways to prevent kidney stones,"Even if the kidney stones are removed, there is a risk of recurrence. So those who have had stones once, should follow some advice.",Business,http://cdn.kalerkantho.com/public/news_images/2023/12/09/og/1702116145-3be8e8b6dce0b85db8a5e54312710b64.jpg
2023-12-09,kalerkantho,https://www.kalerkantho.com/online/country-news/2023/12/09/1343882,উপকূল থেকে হারিয়ে যাচ্ছে খেজুর গাছ,শীতের সঙ্গে নিবিড় সম্পর্ক রয়েছে খেজুর গাছের। শীতকালে গ্রামবাংলার ঐতিহ্যবাহী খেজুরগাছ থেকে পাওয়া যায় সুমিষ্ট রস ও গুড়। ফল হিসেবেও খেজুরের জুড়ি নেই।,Palm trees are disappearing from the coast,"Palm trees have a close relationship with winter. In winter, sweet juice and molasses are obtained from the traditional palm trees of rural Bengal. As a fruit, there is no pair of dates.",Health,http://cdn.kalerkantho.com/public/news_images/2023/12/09/og/1702093426-6fd33470dea458ab90e18c964caa6eb9.jpg
2023-12-09,kalerkantho,https://www.kalerkantho.com/online/entertainment/2023/12/09/1343883,রণবীর কাপুরের নায়িকা হতে চেয়েছিলেন সারা,ক্যারিয়ারের শুরুতে দ্বিতীয় ছবি ‘সিম্বা’য় নায়িকা হয়েছিলেন রণবীর সিংয়ের। এরপর সারা আলী খান হতে চেয়েছিলেন রণবীর কাপুরের নায়িকা।,Sara wanted to be Ranbir Kapoor's heroine,"At the beginning of his career, Ranveer Singh became the heroine in the second film 'Simmba'. After that, Sara Ali Khan wanted to be Ranbir Kapoor's heroine.",Sports,http://cdn.kalerkantho.com/public/news_images/2023/12/09/og/1702095326-d910c0bfa749cd12cea822ced3c1f8b7.jpg
2023-12-09,kalerkantho,https://www.kalerkantho.com/online/country-news/2023/12/09/1343884,বরিশালে ‘কুরআনের নূর’ প্রতিযোগিতার অডিশন শুরু,কোমলমতি হাফেজদের প্রাণবন্ত উপস্থিতিতে আন্তর্জাতিক হিফজুল কুরআন প্রতিযোগিতা-২০২৪ এর বরিশাল বিভাগের অডিশন শুরু হয়েছে।,Audition for 'Qur'an Noor' competition has started in Barisal,Audition of Barisal Division of International Hifzul Quran Competition-2024 has started with lively presence of Komalmati Hafez.,Education,http://cdn.kalerkantho.com/public/news_images/2023/12/09/og/1702095924-a992f07d19721dbf74df68c1ed4e7c56.jpg
2023-12-09,kalerkantho,https://www.kalerkantho.com/online/prescription/2023/12/09/1343885,শীতে শিশুর অসুখবিসুখ,এ সময় শিশুকে সুস্থ রাখার করণীয় সম্বদ্ধে জানাচ্ছেন চট্টগ্রাম মেডিক্যাল কলেজ হাসপাতালের শিশুস্বাস্থ্য বিভাগের সাবেক বিভাগীয় প্রধান অধ্যাপক ডা. প্রণব কুমার চৌধুরী,Child sickness in winter,"At this time, the former head of the Child Health Department of Chittagong Medical College Hospital, Prof. Dr. Pranab Kumar Chowdhury",Environment,http://cdn.kalerkantho.com/public/news_images/2023/12/09/og/1702095938-1a9876ba2e469997d21a0c3eafdadfc2.jpg
